update open rent sewa iphone 14 pro 128gb konser  event kpop dom jakarta pusat xdinary heroes yoona snsd chanyeol exo sam kim bobby ikon nichkhun iu shi nct dream tds 3 baekhyun kim seonho reboot treasure utk xdinary avail ya karna tbtb cancel https t co cwwmkblw6v,Positif
pelan pelan kakkk,Netral
trs kerjany sm yaaa enak bgt artis karna kalo style sm ga maksimal jd doi milih modal yakk,Netral
krn abang nct yg tani versi serius  krn harap orang tua yg ken penuhin amp harap kerja bareng idol hehehe,Netral
ryo dada kalo belah langsung bunyi to the world yeogin nct,Netral
dek ryo dreamzen paham yaa,Netral
kurban ya,Netral
ganteng bgt yut,Netral
gila dark hair ganteng bgt banggggg,Netral
gua pas liat denger lagu sos nct dream inget kalo anak dreamies udah gak udah adee ,Positif
wts aab nct fact check x mecimaaa ready ina co 3 3 keep shope join go yaaa wts wtb aab nct https t co zio3fewiwt,Positif
lamaaa giler i active  jom moots i still suka apek renjun and bujang nct,Positif
luvall mmuach mmuach ga milih,Netral
help rt amp like bias haechan rapat rekomendasi outfit t shirt haechan nct  https t co sszli84z32 racunbelanja racunshopee pasarnct nctzen sijeuni zonajajan zonauang fashion,Positif
sm gabisa diharepin,Netral
sedih bnget,Netral
ihhh gapapa padahall,Netral
ryo asn yo,Netral
ken jersey nct nation haechan,Netral
111111 gak suka sayur btw lagu wajib lisgo by nct dream shameless promotion,Negatif
wtb  want to buy nct dream x cgv tumblr mark haechan drop harga bersih ina nya bawa figurenya ajaa kalo bisa,Positif
kkyu emang dah lekat dream coba gin happy happy gak apa ryo sijeuni kayak banget nct fandom-nya hmzzz,Positif
wkwowkwo ryo tolak ,Netral
wts sharing lightstick sm artis ls nct 570k dp 480k  ls exo 590k dp 495k   fix co  bersih ina  go line  sung dp langsung co in order  dm wts ls nct dream 127 exo,Positif
mark mak ku kl nyari cowok yg setia kerja keras taat agama kl mark lee,Netral
juragan sapi nya nct buka cabang indo sion jamin laku,Netral
help rt like hi pre-order popsocket akrilik jeno nct bogor  22k  freebies random https t co uqphowyv2e yu tanya dm aja thank you  zonajajan pasarnct zonauang wts wtb,Positif
update slot   yuk dibook slotnya https t co ew5tngcjxa t tiket tix wts wtb jastip jaswar nct dream tds tds3 jakarta,Positif
 open jastip nct 127 md the great unity exhibition  tera picture  bersih ina  packing 8k  admin 5 jatim  open sharing nct 127 random photocard  a vers   tera picture  bersih ina  packing 8k  admin 5 jatim wtsnct nct127 thegreatunity https t co pemo7rrtnj,Positif
help rt like real pict popsocket treasure bts enhypen nct wts bogor  22k  freebies random  via oren https t co x6bgqv8s3y  kerja 1-5 zonauang zonajajan pasartreasure pasarbts pasarnct pasarenhypen,Positif
lokal bgt yusirik,Netral
nct  songkang ,Netral
juluk lucu bgt juragan sapi ,Netral
iyaa kena tuh,Netral
nct wish benera wishkas yatuhan,Positif
dream hyung sih kek noprob ya ya ga tau fansnya dream ryo takut fans dream hyung yg ga suka pake pose karna ngerasa udah kek official pose dream mrk yg pose gue yg ketar tir,Positif
aheng harga mati,Netral
ryooo its okkk bayi takut kenapa2 sijeuni,Netral
minimal hrs liat hari naikin mood,Netral
ngingetin ryo ya soalny gue ga ikutin nct wish makasih ya ryo udah ngingetin moga nemuin sign sendiri kkyu udah lekat dream sepakat kalo ketemu kkyu terus kkyu,Positif
buset yg nempel badan aja udah beli rumah ya allah ,Netral
gapapa dekk takuttt pokok nct all unit kyuuuu jaemin bangga adeknya ikut kyuu,Netral
wtb pc riku nct wish ,Positif
kalo k korday skr yg kuhype cm nct wkwkwkwkwk kalo yg cover either lagu or dance d pakuwon aja rerata girl groups yg dicover ,Netral
ryo adl sijeuni  sllu tau apa hahah,Netral
0 nya ya bund nyala 0 kuhh ,Netral
jujur sedih sebenernya,Netral
iyaa ignya yuta tgl 23 maret 2023,Netral
nct paozinho,Netral
nct wish amp riize ,Positif
po nct wish - single album wish photobook ver 140k  dp 50k bersih ina lunas  emstax packing bogor jabar  slot  dm for detail  https t co cnkg6vpxua,Positif
syarat nct tu lovlangnya physical touch,Netral
si adek takut yaa  paham sii,Netral
nct yg 26 aja ga milih apalgi mek 4,Netral
omggg red flagnya luntur kalo kyk gin mah,Netral
photoshoot majalah jepang,Netral
jujur emang lagu lumayan enak lagu nct gue skip karna ga cocok,Netral
mjb iyaa kwkw photoshoot majalah,Netral
wkwkkwkw toxic ga malu toxic sampe member nya takut perkara kyu aja,Netral
eh rl w gondok draw card nct zone  beneran asa buang diass mari pulung dias lagi,Netral
gapapa dekkk ,Netral
langsung lepas kyu nya ,Netral
po nct wish - single album wish photobook ver 140k  dp 50k bersih ina lunas  emstax packing bogor jabar  slot  dm for detail  https t co loskvtd7ip,Positif
po nct wish - single album wish photobook ver 140k  dp 50k bersih ina lunas  emstax packing bogor jabar  slot  dm for detail  https t co fhmqezuhsw,Positif
burem mata gw liat harga ,Netral
ya der foto majalah smpe gua jdiin benner saking semsem sma hasil,Netral
sms wts pc nct jungwoo jaehyun keep event,Netral
pose kyu si ryo langsung sadar pose sunbaenim,Netral
aaaaaaaa ganteng banget na,Netral
gpp dek misi jaemin hyungmu hasil wkwk,Netral
kasiaaan adek jd takuut,Netral
emang tuh ganteng itu suka tutup jametnya aja ,Netral
ryo takut fans abang2nya marah ya karna kyu identik abang hati yaa ryoo ,Netral
simpuh ugal-ugalan hadap nakamoto yuta,Netral
gua siang sampe nnton weekly idol nct dream yg ngobatin kangen,Positif
want to sell wts nct slogan cheering kit haechan 180k jakarta indonesia ww paypal  ina bank  splitpay kirim shopee https t co uz8oc5og15,Positif
gpp cil orang ajak kkyuu ,Netral
dengerin lagu nct wish mami judul wish,Positif
anak2 uji kali nama2 member nct wish https t co p76bvdcamz,Positif
ya allah  kangen nct hahahah,Netral
yuta niiii kesana kesiniii,Netral
woii jual lightstick exo album nct dream exo mohong beli,Positif
gaizzz sh panjang ya,Netral
ken suka nct ko mager,Netral
kaya temenku sumpah bilang udah suka nct nyebut chenle chonlo kek apasih anjir suka km repot ,Netral
ntar sponsor konser nct dream bank star lg ga yaaa biar w dapet tiket gratis lg wrwrwrr,Positif
siap idul adha nya cepet bngt ya yon,Netral
kyuu gitu ya si ryo takut ,Netral
sm kerja ngapain wkwkwk promosiin gak maksimal keren mbak legend tyongf kemaren eh outfit mandiri idolnya wkwkw,Netral
adaa sg24 sealed nct dreamm,Netral
or anything album nct kecuali album haechan cover,Netral
woi admin nct dream kmn njirrr kagak apdet2,Positif
buset bang butuh beban gak ak beban,Netral
iyaaa gw jg ga terima kalo pure korea  trus gw umur umur tau orang kek taeyong ,Netral
ngeri2 sedap ya ryoo he knows the situation bruh,Netral
bikin terna sapiii kali yee,Netral
aku kalo nct dream is blue drimjen darah biru https t co eadtnvjtzo,Positif
omg bubu outfitnya harga rumah gedong,Netral
09l nggak ikut kah,Netral
taeyong nct comeback solois rilis mini-album dua tap https t co fztqy6jr55,Netral
 po  nct jaehyun cheesejae 40 cm doll by 40cm doll  hat 670k dp 450k  14 3 12 00 wib  est ems  tax  cicil  reseller  go line  ch kr local shipping  packing  tgr https t co nmku5hojdl,Negatif
kaa haloo jg beli v29 konser tp review pda jelek jd nano nano,Netral
jeno jaehyun nct,Netral
woyyyyy bang atuy,Netral
renjun nct sunoo enhypennnn,Netral
nct drop foto dreamis yg lucu dong ku freebies nnti tds3 ,Positif
adaa nct dream otw,Positif
makasih doa nya emg beneran sakit  btw foto dah aja cakep ya lakik gueee,Negatif
moots nyari jeno sg 24 set ga os nih 100k udah bersih ina dapetnya sg 24 set pob poster lipat co 3 3 dom tasikmalaya t wts wto season greatings nct dream mark renjun jeno haechan jaemin chenle jisung nct 2024 lfb,Positif
tau tau konten nct dream membership weverse ,Positif
240229 taeyong komentar postingan ignya top 100  nct127  https t co gfrpxkicn0,Positif
rp 857 785 000 - total,Netral
klik beli https t co gj4n8e51l9 bts nct kpop army bangtan https t co jhhtizxsdr,Netral
lucu banget juragan sapi,Netral
w sih sinar babi mah gasss,Netral
maaf bgt cowok nct tp lg pindah haluan  https t co cjubyithia,Netral
po nct wish - single album wish photobook ver 140k  dp 50k bersih ina lunas  emstax packing bogor jabar  slot  pc for detail  t nct wish album debut singel sion riku yushi jaehee ryo sakuya https t co boiymkkg6b,Positif
jalan nanya spill harga outfit lo,Netral
definisi bawa rumah,Netral
ya allah gue greget bgt nct dream ganti layout gue udah nungguin aaarrggghhhh,Positif
modal ya yong emng keren bngt sihh,Netral
sms wts ready kirim nct 127 johnny the unity track jacket notnot udah susah bgt loh cari up 1juta langsung cek tweet bawah aja ya,Positif
nge fancam gilga kek gin hasil nano nano bsk bawa konser https t co gzrx8ggoak,Netral
yg badan udah beli rumah tp klo ketemu yg bayar ,Netral
bujukkk ampun suhuu,Netral
190301 zzin pd ig  jaemin nct nctdream https t co jyajh8xaea,Netral
sm ngapain ,Netral
gatau tp review jelek  beli vivo v29 wkwk,Netral
q 1 who in riize was a former nct u member a shotaro b eunseok c seunghan,Netral
kalo nct sih pas nder tpi klo riize gatau,Netral
maaf yg cowo kirain sion nct wish wkwk yaampun baang pdhl udah prnh liat kmu queen umbrella,Positif
nyalain api nya abang ku ,Netral
harga turun sudah rang 5k-10k wts pc photocard nct dream 127 bts exo ready ina co by live video chenle mark taeil yuta renjun jisung chanyeol hun kai rm namjoon jungkook jk jhope jin v taehyung wtb wtt mpc postcard photostrip lenticular doll boneka mini jeno 5cm https t co 9iiezlhwip,Positif
240229 interview nctwish oricon  https t co dyjxznc5iq  https t co ohbcghfhff,Netral
ty be like barang bagus gue manfaatin,Positif
udaaa ngejar boral aset gelimang lagi duhh cewe untung dapetin lo yonggg,Netral
bbrp nih pc nct dr nature republic ,Netral
tyong butuh bantu ,Netral
cantik maahhh,Netral
wts pc bts enhypen txt seventeen nct dream nct 127 just b the boyz stray kids ina yukk take murce nih keep event shopee or request live shopee  condi or nego bgt langsung dm aja ya maaciw https t co fpslfvqtvq,Positif
era nct 2020 tuh masuk era yak turn back time kaya,Netral
duit lu jg ya yong,Netral
akuu kakk nct 127,Netral
beli cincin yg kudu po 26k aja mikir  a,Negatif
nct nya nih kak  https t co 2utidtkvp6,Netral
nooo kalian sksnshsksm gak apa sayanggggggg gausah takut abang ga marahin nnti klo akgae ga ngoceh tk slepet berani nya sm bontot nct https t co cby3kpjpo8,Netral
wts small titi  album smini shalala 450k  sealed  ready kamar good condi  inc all  adm   freebies  jatim wts small titi smini shalala taeyong nct pasarnct https t co bjpdsicnww,Positif
official 240229 jaemin weverse update  sudah 4 tanggal 29 datang senang sisa cepat tidur sijeuni https t co exqywgjzhd nct nctdream  https t co xghqv2oy0n,Netral
efektif gak gak tau deh play aja yekan https t co ixbxox0kue,Positif
butuh beban hidup ga yong,Netral
udh ga main nct zone anak bosenan game  harus kejar km taeil steampunk https t co vq5fqu1ckm,Netral
beli ges murah bgt yg jual kasih pantun kalo beli tags lightstick nct ready ina wts lfb,Positif
udah cocok vokalis nct ,Netral
peluk member nct,Netral
nct 2020 udah banget no debat era hotsa helfut ,Negatif
duit bgt yak,Netral
nct dream yg ngelakuin ewww cringe bgt yall grown ass men grup yg lakuin omggg baby you re saurr cuteeeeeeeee,Negatif
dikenalin temen trs eh seru nct 2020,Netral
butuh persod ya jersey basketball nct mark sold ya webs 1 270k tax,Netral
nct taeyong guyss bilang sh cr pic rubyrose92 https t co iopm29syn3,Netral
iyaaa seating semuaaa klo nonton ambil murah kayak fat nct konser hhhh pusinggg ,Netral
ngga mas ana pgn bgt miara bayi sapi,Netral
kak huhuhu gak kuaat gemes bgt ini hanbin puji langsung leader pusat nct gak pingsan ya dia,Netral
pls iya butuh bgt biar sembuhh  do0 nct,Positif
wts pc nct take all only 6 300k  ready kamar  inc all  adm   freebies tambah freebies ofc  nego allowed  jatim cek condi langsung dm boleh wts pc nct dream 127 wayv pasarnct https t co up7kpve27t,Positif
eh coba lg seng dm kamuu jga g bisa,Netral
onriyu jirrr klo yusirik gw bingunggg,Netral
renjun nct dream wkwk,Positif
sms malem chinggu kuy join go nct dream 127 wayv wish by skrggg  domtangsel  linkdibawah ya 11 8 2300 123 465 3 900 330 https t co tfyajs546c,Positif
iya deh maafin btw ava renjun from nct dream ya kak ihhh lucu ya anak ,Positif
hypebeastkr instastory update with taeyong hallo nct taeyong interview qna hypebeast kalo penasaran album baru tap side tracks lain lupa baca interviewnya taeyong  https t co bs9vauoaqt https t co r77mbiqfuz,Netral
erreka asemmm dah gak nonton nct ngajakkk,Netral
wkwkwkwkww eh ya allah kasi amat,Netral
eh ga open dm deng,Netral
wls malem chinggu kuy join go nct dream 127 wayv wish by skrggg  domtangsel  linkdibawah ya 11 8 2300 123 465 3 900 330 https t co mifrlvkoji,Positif
cdm kakk,Netral
woy p gue stan nct dah,Netral
gue liat nct wish udh kek liat nct dream kaga beda,Positif
karo dichi dino wasapan bahase nct ros ,Netral
ga ya harga tiket tds3 gin anjeer konser nct mahal betuull,Netral
nagalit pa nga kayo nung ni retweet lang ng official nct acct yung post ng wishies kasi nag overlap siya sa ibang members diba,Negatif
gua liat nct wish kaya bayi maaf ,Positif
grgr baca au amp amp wkt abis nntn mrs byk bgt org yg ngedit foto mrk sm 00l kyk iya jg ya si jaemin deh sm iqbaal kilas poin konten nct dream jatuh cinta jalur uri jisungie mwoya mwoyaa kterusan deh jd kpopers sampe skrg ,Positif
akuu tarik sma nct krna jaemin pas allobank trnyta jaemin series nonton eh sukaa trs video hc suka jg laah bias ku jaemin haechan,Negatif
renjun nct dream,Positif
si nct dream beneran gak bikin gebrak apa rewatch sigle inferno ampe 100x https t co ooxjwmoesr,Positif
kalo 26 pilih 1 pilih,Netral
syarat masik nct peluk kek t t,Netral
bener bacain good comment aja kangen bgt ngirim mf base ttg lucas trus reply nya bagus bagus seru bgt yg sayang lucas yg ketemu nct karna lucas jg sih wkwk lucu abis ngirim base ga abis lucas update ,Positif
calling for nctzen wing wing wing    hy met malem yeorobun nyari go jajan nct mari join go dearmydream new but trusted loh member aktif jajan juga drop jajan murce nih nyelem 4 negara cont,Positif
cas  honne  nct spesialis bolak-balik indonesia,Netral
idul adha kurban taun ,Netral
bikin lapak ka ayo,Netral
emng nct nih c nya clingy,Netral
anak nct nih lovlangnya suka ndusel kah,Netral
tidur ka,Netral
hahahah sumpah gemeccc nct wish liat bokemnya,Positif
yg ngomongin siapa ryo makasih ya btw kek fans nct ya makas ya udah negor temennya kaga bayang inssa nya,Netral
emang beliau cantik bgt bjir tau he is psychometric udah familiar muka dijadiin fc au nct,Netral
bruh emg gaada ht jungwoo wkwk trs lu ngapain nyantumin tod s nct kalo gaada htnya,Netral
tebak lagu part 4 hadiah saldo receh reply with format answer  tags johnny suh for acne studios acnestudiosxjohnnysuh acnestudiosfw24 johnny rep 1 kali clue nct https t co i0cjeyblt9,Netral
bener potosyut thn 22 23 yhh ak lupa,Netral
nct tuh ya clingy bgt,Netral
jujur gua sndiri jg suka kangen nct era 2020 pakmen,Netral
kak haechan bene holo sg22 nct 127 18k ajaa,Netral
gemey bangettttttt masuk nct jiwa bakwan sayur join donk banhh,Positif
kpn ya wish join nct zone butuh buruh pabrik ,Positif
yuu cari album be there for me nct 127 open po nihh akhir  sealed  ver b only  bersih ina go bandung 75k dp 25k langsung dm aja yaaa slot batas t wts wtb wto nct 127 winter be there for me sealed stereo ver btfm,Negatif
udh member nct ryo jiwa nctzen nya sampe tau kyuu pose identik dreamies ,Netral
smuanya knp hrs,Netral
udah dengerin lagu nct dream yg beatnya mantep sendu,Positif
sijeni dunia bingung ,Netral
nct life mini kaya kak https t co xdldnz9wea,Netral
nih nct dream ganti layout ya cb gimna sih sm,Positif
nct life mini channel nimdeul ya kak bangkok  staff benerin baju taeyong ya,Netral
ntar pas idul adha jual yaa lakuu tuhh,Netral
w heran ni kek nct dream doang yg sepi konten ya,Positif
juragan sapi usia muda bayangin tampan muda kaya raya,Netral
maksud lu usahain apa,Netral
wtb pc jeno jaemin nct dream  video inc all keep event prefer dom jabodetabek era aja yg lucu gemes yg sevibes,Positif
ha gmn gmn,Positif
yusirik,Netral
liat jaehyun mode miskin,Netral
yuta rambut ga gondrong cakep bgt,Netral
open po handcarry korea nct the great unity official md eta jakarta 7 maret dp amp lunas shopee dm  chat kkt for fast reponse https t co izt0qjbqug https t co ej7mb9u0jg,Positif
240229 ten super junior lss - joke challenge super junior s shindong siwon  wayv  https t co nml1kq9ll9,Positif
wawancara taeyong nct saya capai salah impi 10 milik debut saya taeyong tap taeyong   https t co qv9cvhpzjn,Netral
nct stands for neo clingy tantrum kalo ga nempel2 ya ribut petakilan berisik ,Negatif
dvd nct nation resah,Netral
help rt ya makasih wts  want to sale pc jeno nct dream https t co hztjthtoif  good condi dm aja lbh detail dom jakarta ina wts wtb nct dream 2023 lee jeno tc istj golden age photocard,Positif
nct n nya nempel c nya clingy t nya tantrum,Negatif
pas nonton nct lastart tuh kagum bgttt sm daeyoung pas cover lagu why vocal nya kuat stabil trainee 3 bulan doang kaget pas bilang ga les vocal nyanyi pas karaoke doang anjing orgil,Netral
bnerbenerr poinn nct gw tuh ini unit tuh syggg bgt gitu loh ni jg adekadek gemes bgtt,Netral
yaampun nct album gemash nan manfaat  https t co qoulqto5ua,Netral
nct nempel clingy,Netral
anyg wkwkwk ciwidey tp,Netral
buset ass em demen aman ngilang2in foto member nct jg kena kaya begini ga ajar salah,Negatif
kek renjun cocok join nct wish hahaha,Positif
ayok dek ngarit date,Netral
gak heran kalo isi anak nct tuh luar antariksa ,Netral
estimasi tabung 15k cb sanggup tidakkk nct dream kangen bawa piala mushow https t co qblogqhjxg,Positif
harta tahta yuta,Netral
 help rt for appreciation   open po acrylic by cemullnono nct 127 ver   est 5-7  kirim seluruh indonesia  dp  fp  grup charm  35k gelang  35k keychain  30k po  29 february - 05 maret 2024 link mesan  https t co a3mspdhat3 nct127 https t co oolmotj3fg,Positif
member nct ntuh pacar kecuali wish anak,Positif
cdm kakk,Netral
cdm kakk,Netral
979 testi panjang tiket bubble lysn nct jaemin t wts wtb bbl murah sm jyp ist jellyfish rbw exo nct itzy wayv suju skz rv langgan bubble jual beli https t co w9bdxrrkoa,Netral
halo yg tiket bubble wa yg bio dm ya wa fastresp dulu bgt wts jual bbl murce murah ppj lysn sm jyp ist stars jellyfish nct 127 dream wayv lucas exo red velvet aespa twice ive zb1 stray kids skz the boyz plave itzy zonauang zonajajan,Positif
lo ayang ucoku,Netral
open jastip tiket tds 3 the dream show nct dream  in jakarta limited slot fee 350-500k data buyer testimoni cek bio tnc jastip isi gform  https t co hf5poafsib tag wtb wts jastip jaswar nctdream nctdream thedreamshow3 zonaba zonajajan zonauang https t co xm2ssyspkd,Positif
trans 240229 nctwish weverse live  kalo liat komen ini peluk  ga liat 3x eng onlyyushi vid riku3 nw https t co uosmguhjpe,Netral
beli gys yg suka nct,Netral
trans 240229 nctwish weverse live sion bilang spanyol banget merpati pas liat merpati syuting pingsan eng amp vid sionsarchives https t co hpfvcowrrk,Netral
yutaaa ,Netral
me  mam nntn iu sm siapa cat brp jdnya mom  sm tmn mami kali tante l jg me  ga yaudah nct lg aja mom  ya si nct ga bosen kesini mulu me  ga aja ga bosen beda2 lagu udh gpp tp kl iu bayarin ikt ya ,Netral
onriyu ya anjirrr ngapa yusirik lo ngeledek ya nder iya emang gue sirik mang napa sie,Netral
rp jeno redflag hahahaha rp dominan chara nct,Netral
pilih,Netral
nct udah spiderman ken doll,Netral
thank to allah and thank you nct especially dream sedih obat mereka bahagia sumber juga habis ajar bijak ngelola tuhan titip aku nya antara kalian,Positif
kemarin mo pergi mars silah ,Netral
help rt wts  abb nct halo jualin pc pc ku edisi stopcoll langsung dm yaww  bogor  keep event 3 3 25 4  detail by dm tag wts abb nct jeno renjun jisung doyoung haechan chenle yangyang taeyoung jungwoo https t co egvg3bkrrd,Positif
trans 240229 nctwish weverse live riku bilang yushi aegyo tuh lucu banget fansnya yushi jaehee bilang pingsan liat aegyonya ryo bilang yushi tuh yg lucu wish tp riku langsung ga tuju eng onlyyushi https t co svmwghuaym,Positif
ih gue kangen nct bgt hype pas 2022 ,Netral
knp milih,Netral
ingetin aelaaah pdhl udh lupa bjirr,Netral
tebak lagu part 3 hadiah saldo receh reply with format answer  tags johnny suh for acne studios acnestudiosxjohnnysuh acnestudiosfw24 johnny rep 1 kali clue nct 127 https t co etiaqgudsg,Netral
aja lu yutaaaaaaa,Netral
sma jajan go nct dongg cari wl,Netral
dong inpo,Netral
sumpah yaa ni gw malem nunggu in notif youtube nct dream gesss,Positif
gabisa gweh mode,Netral
guyss adaa org thai jual aksesoris sf x cema nct dream tumblr figure gak yaa 65k bersih thai katalog sihh gemess bgttt  biar figure bias kiyowooo https t co 7dflpaexg1,Positif
anjg bang ,Netral
siapaa naro bawang sini tau taro nct https t co t1qhsjdzbf,Netral
sms wts ready kirim album nct 127 fact check target exclusive ver pc pangeran cek gambar aja req live video cashback 40k langsung cek tweet bawah ini tanya langsung  aja ya,Positif
knp ya nct wish clingy abisssss,Positif
wtb  want to buy open po album nct wish wichu  smart album ver dp nya rendah  cicil https t co j4vucdqhpe,Positif
almost allah nct member taeyong unreal anjir gw burik,Netral
buka jual sapi qurban kh bang,Netral
orang tiktok sih udah riize gaada kait nct stop gw ngamuk  https t co fyrimcnmi9,Negatif
exo riize nct wish ty banget 3 grup atas hidup gw jd tarik gk sepi2,Positif
do0 nct girl ver lowbudget  p s burek bcs i apus shadow reflection bayang gue https t co 7htcclf2f2,Netral
si sakucil kaya brand ambassador md nct wish  https t co coa5bhzsn6,Positif
trans 240229 nctwish weverse live sion bilang weekly idol variety show mereka deg degan banget tp senang juga main games sion bilang nanti skillnya sakuya yg bikin orang kaget eng onlyyushi  https t co odatgoygcq,Netral
sebenernya mo magang nct umur ,Netral
wts aab nct doyoung jaehyun dom jakarta,Netral
biodata profil yushi nct wish hobi sepak bola https t co pawygpcefe,Positif
suju x nct wish,Positif
lah nct nation tc kah,Netral
ihh lucukk bangett mw keyringnya pls wtb nct wish smart album sharing keyringnya aja ga yaa https t co ejwvpyqi5x,Positif
definisi kaya orang kaya,Netral
saksi olah nct dream selamat mbanya,Positif
omgggggg bisa bangettttttt malahhhhhhh,Netral
bias wrecker gue udah aksi ,Negatif
yuta,Netral
wtb sakuya zoom sakuya cimol rd ajaa wtb want to buy sakuya nct wish,Positif
sms jajan season greeting 2024 yukk wayv nct dream nct 127 sealed stock banyaak ridi ina,Positif
woi ak lupa bales,Netral
mah cowok aku,Netral
gabisa milih mon maap maruk,Netral
warning ga liat lama2 kepincut cowo aku,Negatif
ganteng bangett hiksrottt,Netral
iya ndeerr cakep cowoku,Netral
sms malem lezzgoww po doll fanmade bebe 00z nct dream by wangjjen  domjatim bole dpdulu adagonya,Negatif
tebak lagu part 2 hadiah saldo receh reply with format answer  tags johnny suh for acne studios acnestudiosxjohnnysuh acnestudiosfw24 johnny rep 1 kali clue nct 127 https t co qlkker5501,Netral
belio cinta nct sunbaenim dgn ugal an adminnya sung hanbin ,Netral
nct wish lucu bgt siiii,Positif
wls malem kuy po doll fanmade jaehyun nct cheesejae nerojae  dpdulu adagonya lesgow skrg,Negatif
februari post seru februari isi ya gak johnny suh nct xixixixix https t co m6zaj5g0jg,Netral
yakali cowok cakep gk genitin kak rugi donk,Netral
yey dah rumah main nct zone,Netral
emang sultan sibuk ngelantik bang,Netral
wtb aab album wannaone  langsung banyak lagi kangenn t wts wtt treasure nct seventeen exo bts ikon riize,Positif
beneran bocil banget gimana yaaaa nct wish ini gemasss https t co drl3arm27u,Positif
tap lagu tap,Netral
kejar engga timbun orang orang iya gak sih ,Netral
maww,Netral
nabung bjirrr liat nct nct kesini dateng nanti,Netral
hyunjin juga kek dpr ian si yg bilang ganteng member nct tp ya gitu ga tarik biasin suka pesona,Netral
mk nya aja kak fokus fams nya,Netral
ya allah kiro yutaaa ,Netral
ngarit ga yaa ,Netral
ganteng banget,Netral
wts - want to sell sharing photocard set a ver  md the great unity nct 127  45k pc gt gt list prio 8 member  usaha sesuai list cz mba sellkor open trade  limited slot  bersih ina  jatim makassar t wtb,Positif
jaehyunnnnn-aaa pulang nyaman ,Netral
siap kaget info mark nct lulus sarjana fakultas  kampus ,Netral
psell malem take pc nct langsung yah  yg lg cari go nct wayv jg cus  nanya yg ngerti ttg pergoan https t co wywu766sou,Netral
240229  nct via tiktok com o taeyong anton e sohee riize https t co uqyza9utcr https t co ueq0fbqphc,Netral
cb ten ty wish bgt,Positif
skrg gua tau alesan knp nct gak mampir malay ngantri imigrasi gila bgt woi ,Netral
ga expect juragan sapi bjir,Netral
nder ngga kalo upload foto calon suami ijin dulu gasopan gaoaoa save,Positif
gantung kunci nct wish lucu bgtt ajirr,Positif
tq abis save foto,Positif
ryo tuh yg sijeuni casting sm pas nonton konser nct gak sih keren bgt notice kyuuu tuh biasa dreamies,Netral
cakepnyoooooooo 1000x,Netral
bagi nct core  part 2 https t co zbwxy7dcmy,Netral
nct n-nya nempel,Netral
keren bangetttt sehat sehat mba,Netral
loh be3 trio macan,Netral
inget ya ges jdi member nct ryo sijeuni kek adek mantau sijeuni deh aja huru hara yg jadi,Netral
 neocil live jam 80 isi gelendot semuaaaaa bener2 nct c nya clingyyyyy https t co aoerds6rh3,Netral
cakeppp banget ayanggg,Netral
hi need admin nyelem go nct 300 member prefer nyelem jp ch kr yaa tau paham pasar pc nct  prefer nomin markhyuck  senggang minimal hari drop jajan ga ilang2 an yaa fee diobrolin if u interested just knock dm yaa,Positif
member nct orang2 suka oleng karna ganteng visual emang ganteng tp ga yg bikin tarik gitu loh dpr ian idol si yg suka karna ganteng pesona wah liat b aja,Netral
nct wish lucu bgt nempeeeel kaya lem https t co o4fk9mx2hg,Positif
nct c nya clingy,Netral
ryooo sjshsjsjsjaj kaya stan nct wish dri skrng deh blm apal smua member nyaa,Positif
nih ,Netral
nct wish ga kakk ,Positif
besok maret yaaaa udah cegil era nct dream cb,Positif
