lha lucas aja tahan mark bilang anak nct kagak peduli ama lucas bilang anjir trus kemarin acara ten lucas nonton bareng mark ama noh anjir lawak bener dah yg bilang lucas gak peduliin ama nct,Netral
maksud kakak have pc enhypen want pc nct kah ,Positif
lieur anying yg hidup cari nafkah pahala biar izin mudah allah temu svt nct deret teman hibur ku,Netral
wts aab renjun bunny ccomaz tc renbun holo beatbox wink selca sg21 photopack selca lolipop gojek md pc nct dream lfb nct    nctdream renjun https t co mtuzan5dxx,Positif
sama renjun nct ultahku,Netral
wtb pob mecima fact check nct 127 yuta,Netral
semangattt yeaaahhh ayangku actor jaehyun ,Netral
my youth - nct dream every phase of my life kayak lewat dengerin lagu magang stress skripsi stress hidup sampe nyanyi beneran konser,Negatif
 wts  want to sell   cheering kit jaehyun nct 127 amp anton riize jaehyun 200k anton 200k bisa keep event cek condi dm price inc all bandung t riize poca md lfb ina nct 127 cheering kit slogan prince itboy winter https t co xyfkonlssw,Positif
kak bakar loh yg bawa2 narasi libat dz dr td ngebadutin ganti layout ntu akun nct dream ya tiba2 tuduh bawa trauma amp toxic tuduh bakar juga ,Negatif
mari sabtu ads tour,Netral
taeyong haechan jaemin nct gw tau cakep selera gw ttp yuta amp jaehyun,Netral
onriyuuuuu  yusirik ceunah  gue tonjok ya lukh ,Netral
ih suara bagus bangettt ,Netral
wto  want to opslot pc mark bene wd b2s  75k boleh nego co 3 3 yuk guys take bu t wts wtb wto photocard mark lee nct dream 127  ,Positif
lagy cantik dri nct,Netral
jaehyun nct,Netral
yuta undercut mampus sih gua teh,Netral
nak tweet pasal nct wish kat main acc tp takut orang annoyed new unit ni ramai orang layan,Positif
aduh ngga milih,Netral
selamat malam nct dream pose kyuu nya masuk koran https t co vx28uluj9p,Positif
lucu bgt nct wish nama nct hana wkwkk tp gajadi kalo hana yg dul set ipk gibran,Positif
tap tap tap taping on me  https t co sdzpw548za,Netral
pesona gemini kah,Netral
sudaaa bener-benerr legowoo gapapaa bangett ya allahh ga nonton tds 3 jumpa nct dream asalkann kuliahkuu selesaiii waktuuu,Positif
nct dream clingy tpi 1 kali duduk tuh member kyk live ot7 terkhir jeno jaemin nempel mark nct wish 1 kali duduk langsung nempel bjir klo duduk 1 sofa dreamies dempet an kalo wish pangku an kaya,Positif
bai ter nct e bts juntos mdssssss,Netral
jeano amp gisella part xiv jenselle royalatte au feat aespa au nct au kisah cinta metaverse game tittle  kwangyaralove sub tittle  real world  game online bikin mati dunia nyata ixy https t co c2dqeposwp,Netral
oke sorry ngestand nct mangkanya ku dreamzen tuh nama sayang nct dream gtu nctzen tuh unit nct sorry kalo salah maaf kalo like ku salah,Positif
juragan ikan game gak nikah ak,Netral
bgt dz sllu adu embe sitijen curigaaa ntar comeback nct dream kali ni sukses besaaaar,Positif
ga ragu emng leader top markotop,Positif
ngedance dg wardrobe harga kpr rumah,Netral
fyi aja yaa join jd bom tau ngga nctzen unitzen does exist contoh dreamzen stan nct dream aja 127 wayv wish ,Positif
yushi  https t co 9uadl3qqhw,Netral
kalo iya iya kalo engga engga jd org jgn kaya kontol ngapa,Netral
owalah maaf kalo gtu ku unit nct nama fandomnya nctzen sorry stand nct,Negatif
kalo lo sadar keti lo salah tau rame yg kontra mending lu hapus kalo tangis nasip idola lo mending lu banding unit nct aja jelas lu bandingin riize,Netral
lagu ballad nct 2020,Netral
owalah beda ya ka  ku nct tuh nctzen sorry alam ngikutin nct,Negatif
gw kek enjoyer aja yg gak masuk fandom deh tmi emang kepincut shotaro si pas jaman magang nct trus kemarin2 kepincut sohee gegara nyanyi the little prince pas smtown tp abis liat perform 119 kepincut si gondrong gw lupa lg nama,Positif
me as caratzen celebrating nct amp svt feb boys birthday 12 dalem kalender borong ultahnya februari happy birthday ya bujank kuuu https t co ulyl3buxhd,Positif
ngincer dery nct nation baju putih plissss iniiiiiii etmin cinta ku persod ga aktif ,Netral
plisss,Netral
nct wish blm w terjunin bener2 tp kek mudah ya hati w bawa ,Positif
kepala gua lintas member nct dah,Netral
cintakuuu,Netral
besok subuh morning news jp byk berita nct wish gue bgt,Positif
cakep bgt sayangggg,Netral
benar istri leader pusat nct ,Netral
banyak nct enha seventeen ganteng2 pollll kepincut aja suka visual cewe2,Netral
sorry la nct members byk attractive korang tak faham ,Positif
inimah beneran cinta sandung juragan sapi,Netral
yuta tuh kaya kalo ngejamet jamet banget style nya kalo style nya bener ganteng banget,Netral
lucu bgt basa basi km suka nct gak sih suka si pakein jaket ituuu yaaaa omg  beneran interaksi duga ibuk manager,Netral
kayak ngasih jarak debut nct wish senin besok  weekend gak rilis teaser,Positif
yo dream aigoo kkyu udah love language nya nct dream member dreamzens love language yg paham kita aja gemass sekali dreamies dreamzens ku           https t co jz0cwuyi7m,Positif
nyewain lightstick nct ga zonauang,Netral
yah gitu deh emg gk ngatur pikir org kasi sih yah udh konsekuensi mrka jdi entertain kasih dukung yg aja kmreka ,Positif
ku usaha pria matang mapan nan rupawan enih ya allah kalo nikung jalur langit macet ngga yaaa ,Netral
yg lain bkn gw wkwk,Netral
temen gua suka nct ngobrolin tuh bias haechan temen gua ngomong oh mantan si arin udah putus laki dokyeom seventeen gua speechless,Negatif
tresur jg pls  sedih bgttt fanmade nct lucu lucu pol tp jarang liat tresur ,Positif
lihat twtan yg wkwk,Netral
iyaaaa bom nct jg byk yg bom wkwkwkw ntr gw satuin lg brg riize jg,Netral
mari mari goyang nct wish hey hey mari berstreaming jangan lupa pake nada upin ipin goyang mari,Positif
ye kan slma in gua gk tau pas ad yg ngomong gitu td gua nyari tau lgi eh trnyta bner d hate perkara pose doang bjir anak dream jg past sdih bngt kek gin aja anak wish d hate mrk msih bocil debut udh d hate emng fandom ijo pling toxic nct,Negatif
hehehe pacar akuu ,Netral
idung mancung bats dah,Netral
g niat war wkwk emg kata jelek in dz cmn dejavu aja dlu neocil prnh kena mslh kyuuu,Negatif
admin nct dream gak niat ganti layout kahh,Positif
wkwkwk duaduanya gemes anjir kek taeyong tau deh hanbin demen ama nct wkwk hanbinnya liat whipped bgt taeyong ,Netral
pas kali kenal taeyong gitu tuh patung lilin  rambut putih era fire truck situ bener mikir human or patung sih takut slh ko jalan njir,Negatif
bang bayarin s2 banggg,Netral
dahlaa kak ytta aja takut yg sakit perkara gni dwg wkwk pdhl cmn blg kasi aja gtu neocil kek pas ryo blg sunbae muka sion tekan bgt udh paham mrka jga pdhl ga niat nyenggol dz tpi ,Netral
semangat banh https t co zont83sv5g,Netral
inget banget nct dream era hello future sampe skrg ga sampean beli album ngikutin banget sampe konser vlive aja w beli anjirrrr,Positif
ya gue uang orang tua ga lupa sedekah beli merchandise nct yg gue mau,Netral
boss - nct u top tier unit nct u aku konsep lagu teaser mv utama kostum sukaaa banget bener-bener mewah ni unit perform nct nation kemarin liat sabuk resleting baju jungwoo kaya gak guna ya ,Negatif
cikal nct dream part 2 alias teman mrk bkln aweeettttt deketttt bgt karna udh bareng2 dini ayok adik2 yg rukun trs yaaa ,Positif
it s no biggie case kali most of dz praising ryo udah respect dream yg aji mumpung bgt twisting harmless twt apa2 bikin war ,Positif
iyah anjir kaga ,Netral
10 biji au udah sesuai yg sender mau anak kampus famous anak organisasi cast nct  1 au nya eunseok riize https t co eqapudfr5y,Netral
mm ckup rame sih krna wkt new team blom serame skrng fans nya jd kek gk bgitu angkat tpi pribadi gk nanggepin sih fandom aja yg pola pkirnya gitu,Netral
yuta kek spek animek,Netral
semangat guyss moga ga antem mulu yaa biar ga pisah kartu keluargaa,Netral
nama nya aja udah beda gak awal nct giat grup sulit karena tegang negara amp politik labelv sebenernya nyari job china tanggungjawab label kek gimanapun jalan gak gampang,Netral
moga member nct sehat bahagia moga nct depan sinar terang benderang ijo nyala abangkuhhh yg sayang kenal orang kakakaka ngadain ga makasih yaa moga sehat bahagia jugaa,Netral
ga kepo akun aja nct wish gitu maksud  https t co bkm8i5mm34,Positif
sorry bgt tpi gw yg dreamzen ktar ktir pas kyuu pose i know dreamzen yg pinter tpi ga mungkir dijadiin ajang war tau jdi stop denial klo sijeuni war unit eh ga unit aja sih tpi akgae juga,Negatif
jaehyun,Netral
udah ga nonton weekly idol mc eunhyuk resign mingdep kecuali sih nct wish gajjjaaaaaa,Positif
lahh gilee rugi kalo pilih satuu https t co 7f3aoztoti,Netral
album sj punya album exo bbrp album nct punya tinggal album riize,Netral
huaaa yutaaaaaaa cakep bgt,Netral
jaeminn nct hari sama beda doang,Netral
jg st dream family neo  suka sedih aja 1unit pdhl tp sllu war wer wor,Negatif
gue ganyangka udh tahap ini gue nge stan bg sm nct doang jd suka riize juga stan sj shinee trs exo abis nct skrg nambah riize,Netral
wtb album nct 2018 2020 2021 2023 cari harga under 100k nego ya,Netral
susah ngafalin member nct wish,Positif
duh jd suka juragan sapi,Netral
mark hehe,Netral
fyi aja udh fase harap admin nct dream krn fuck is tired harap jam 18 00 20 00 and 22 00 admin nct dream upload yg hubung dg dreamies ,Negatif
sayang nct wish banyak,Positif
wtb gomdo lee doll haechan ready aja yg sampe indo maks april tag wtb wts gomdo lee doll haechan nct,Positif
muda nct dream  pikir banyak lahir 00 line,Positif
bnr bgt kak sampe war dlu,Negatif
beli rumah cromyyyy brand nya ,Netral
siap kurban ,Netral
pernah pas predebut tour byk fans yg mreka pose itu gk smua fans dream y ckup byk yg masalah,Positif
bilang stan nct dream kah kak wkwk,Positif
yuk yg dr sby-sidoarjo-madiun-solo lg cari transport pp nonton nct dream tds 3 jakarta gabung  tds3 nct dream nctdream thedreamshow3 the dream show nctdream thedreamshow3 https t co dnh4mndgbo,Positif
yuta,Netral
sm pelit bgt bjir,Netral
asli gk bsa d bilangin bjirrr,Netral
nct 2021 beautiful sumpah pas intro johnny bilang you the most important in your life langsung nang lagu ,Positif
t wts wtb wto aab nct enhypen treasure album photocard pc haechan jaemin jeno mark jisung chenle renjun jaehyun taeyong taeil jungwoo jay jake sunoo sunghoon jungwon heeseung nik jihoon haruto asah junghwan hyunsuk doyoung yoshi jaehyuk jeongwoo junkyu,Positif
siap rico nda sabar gebrak rico nct wish,Positif
scroll aja wkwk bnyk yg komen jg mrka dh tau dlu gmn btw prnh kyu dlu neocil pas acara ya lupa wkwk,Netral
rest gak lrp ,Netral
https t co 96ymevc2d7 baca ya stan nct dream,Positif
minimal baca full konteks sih kak diem nunggu ganti layout gin tetiba bilang toxic,Netral
yohooo hyung ,Netral
sebenernya tuh emg nctzen yg alah ikut an nct dream bla bla bla ga banyak aja baik suasana tpi yg liat tuh dreamzen bikin anak trauma blablabla ku bikin suasana kacau hadeuhh,Negatif
klo juragan sapi model gin gass aja,Netral
emang fandom ya kalo dreamstan ngga apa sih syukur,Netral
loyo upchar jor-joran ,Netral
iya tah kak kapan emang member wish pose kkyu ini asbun kak,Positif
1 kemarin jaemin aktif bgt 2 gak kalah d aktif moga 3 nct jaemin comeback drama gk nyambung si tp dr doa ku utk jm https t co rj3jx8vuwe,Negatif
kasi nct fansnya egois ,Netral
main groups gw berisik tuh ya nga shinee nga nct,Netral
fandom rada sensitif dreamstan fine fine aja inget jadi anak wish bilang plagiat lisgo pdhl cover showcase nya ,Positif
iya anjir gw inget space yg tbtb spill a famous idol smoking hangout sm cewe club udh bikin huru hara ngasih tebak2an gajelas mancing arah nct enha bangsat gataunya idol nugu anjing,Netral
does nct dream own the kyu pose iyyahhh,Positif
doyoung selca sanrio x nct 45k aja incl all kak dom jayeng https t co 6kqhkms7dz,Netral
kalo bilang nct terooos,Netral
normal warna hijau neon nyala nyala iya ga normal hijau neon nct biru shapire suju warna warni sepentin,Netral
nct wish - hand s up bener2 on repeat bgt skrg,Positif
 please help rt  ga pc anak nct rangka johnny suh pfw2024 with acne stodios - rt and like - drop hastag nya johnny - like komen and save postingan yg postingan  ntar gue drop link nya  drop prof end  2 maret https t co oarztpigti,Positif
nct dream emang famous antero encetean diikutin ya https t co fuy1g6uuyu,Positif
mah ganteng banget asli tutup ketawa jamet nya aja mah gilaaaa ganteng banget cuman saing nya aja jaehyun,Netral
bjirr rame takut banget fakkk,Netral
doyoung taeyong paguyuban abang abang nct gemes sohee,Netral
korang ni sumpah over  sumpah nampak any dreamstan ngamuk  takyahlah nak broke my heart sangat nampaklah member tau harga member dorang sendiri 1 unit jugak nct letih letih,Negatif
fancam anak nct pls kalo hehehe,Positif
riku,Netral
era pling yg bikin gua rugi resonance 2020 udah bilang berkali2 tmn gua that gua nyesel ga kenal nct lama,Netral
nct wish nih masuk gen 5 gk sii,Positif
panik,Netral
buka dlu nct zone ku mutualan,Netral
woilah,Netral
aduh ganteng,Netral
wahh haloo ka,Netral
tiba2 posisi wichu pose alias trademark ya pake trademark pose grup lain ya bawah nct sorry aja nih khas masing2 that s why i said i respect ryo for that kalo lo respect gue respect,Positif
nct t nya touch wakakakakak,Netral
 wts  want to sale  lfb  clearance sale nct amp newjeans all ready ina  harga jadi patok  inc packing exc admin   prefer take dom lampung  detail condi dm https t co 6xu6cpi8hb,Positif
mas diternakin,Netral
keinget tmn ku lho gatau beneran kagak indigo tp suka relate gr gr suka sm nct situ bingung hrus respon tp kaget mahluk kasat mata suka nct,Netral
iya maksud nya paham juga pas riku bilang wichu pose gue panik nya kek ryo ,Netral
nggak yg bikin takut ryo pinter tau harga sunbae nya coba baca translate lengkap https t co h0dutxghvg,Netral
bjir yusirik,Netral
fandom ijo emang lapak perang sodara yawloh,Netral
wts aab doyoung nct nih nder https t co dlmfblynau,Netral
wto  want to opslot in rush photocard renjun gojek we boom  50k rd kr bersih ina  go line dom jakarta amp jatim  packing tax 6k  masuk gonya opslot t wto want to oper slot os renjun helm nct dream pc zonauang zonajajan,Positif
kayak paham kalo sunbaenya udah make pose duluan konteks bikin trend ya bagus sih sadar kalo pake trend kena fans sunbaenya,Netral
open jastip iu her tour concert in jakarta  27-28 apr 2024  ice bsd jastip 250-350k jaswar 150-200k guaranteed trusteed experienced wts wtt wtb kpopers jieun indonesia jkt ticketing services nct 127 dream wish dlwlrma mecima dyandra ck star live https t co cpedcmzejh,Positif
gak chaos ya nct,Negatif
dreamies pose kyyu hujat sm sefandom kak bilang cringe but thanks ryo si nct yg udah protect wishies ,Positif
dlm deh kayak nct wish baruuuuu aja kelar rilis debut singlenya jd habis dreamies,Positif
kalo masukin base gin tengah yaa nggak enak ujung ribut dreamstan nggak yg masalah loh ayoo nih baca translate lengkap https t co h0dutxghvg,Netral
minimal baca https t co o4k6c7yndt,Netral
ngeliat rep mf bikin geleng2 deh ryo ngomong gitu karna takut bully tau nct zen toxic kaya itu nih liat asumsi haha https t co yhub8pvybs,Negatif
wkwkwkwkwkwkwkwkwkwkwkkwkwkwkwkwkwkwkwkw kak,Netral
maaf nanya krn gatau accecoris nya emas kak,Netral
wkwkwkw iyaa sirik liat peluk ikutann kak,Netral
delvote sender ngirim translatean nya jelek ga bener bikin war adminnya mana,Negatif
oalah okeh okeh makasih info,Netral
kiw mas kenalin ak tani ayo sayang ngarit bgt,Netral
nctzen yg nyalahin dreamzen unprovoked anjing lu semua tau ga si ryo ryo ngalangin membernya nge kyu cz nyebut sbg wichu pose gw tau nctzen ga peduli dreamies tp tolong kyu ciri khas dreamies,Netral
hujat anak anak ini tolong bgt mohon kalian ajar kalo kasih tau aja asli pas riku bilang wichu pose langsung panik main untung ryo situ paham,Netral
if u see this qrt w ur bias from each bg 3 bts - yoongu zb1 - mashu nct - taeil renjun xiaojun ryo svt - jun skz - seungmin and lee know ateez - seonghwa txt - soobin p1h - intak monsta x - kihyun 8turn - haemin tbz - juyeon bnd - woonhak and riwoo enha - jake,Negatif
hahahah lucu bgt ,Netral
minimal baca ya ryo brrti harga dream as sunbae negor temennya biar ga pake signature as identitas grup wish https t co exeppkhes3,Positif
dreamis kyuuu nderr https t co oxfp7ktfqa,Netral
coba cari tau lengkap lagi,Netral
wto want to opslot in rush photocard renjun kihno hello  36k rd kr bersih ina  go line dom cirebon  packing tax 6k  masuk gonya opslot t wto want to oper slot os renjun kihno hello future nct dream pc zonauang zonajajan,Positif
tau konteks literasi judge liat nya gimana telaah komen,Netral
nunggu gratis ongkir ,Positif
sumpah pas jd mputjen gw nct,Netral
minimal baca konteks fullnya pose ss time doang pose khas grup https t co h5hun6twsl,Netral
riku mikir kalo pose universal aja pake beda ryo paham fandom,Netral
kalo bawa kebase at least translate nya sampe kelar nder,Netral
nder kalo kirim mf yg lengkap dong capek disalahin mulu,Netral
buseett gausah takut dek hajar aja kalo yg protes,Netral
wkwkwwkwkwk kalo lu stan nct wish gue shock berat,Positif
gue sadar government tax nya nct 15 ya 10 hmmmmm,Netral
kaget gk kaget jg sm kesini kesana agency lama gk becus ngurus artis bakat artis bgt gk urus dg baik promosiin artis jg gk maksimal heran bgt si icha,Netral
ryo udh khatam bgt ni fandom mudah bakar ,Netral
ryo kayak antisipasi si riku bilang pose wichu gera gitu jdi dipake kyuu senior,Netral
ahhh gitu ya tp gua liat koment2 bnyk yg nge klaim2  kyu cmn untk dream bla bla bla  dah pdhl kyuu tuh dr jaman udh  please gk ush apa2 d klaim gua jg dreamzen tp sdih sih klo ad yg nge hate bocil2 wish mrk msih kcil gitu loh bru debut,Positif
wkwkwkwkwkwkkwkwkwk,Netral
akuu akuu si manis kotoko nct mimpi,Netral
komen ngalus bilang fans kasih fakta yg benar ngeri sekaliii,Netral
enak banget ya tim sosmed nct dream nganggurnya,Positif
maaf ini liat sensitif ya mohon sampe war gegara doang malu tahu member makasii orang baik rangin yah war nya,Negatif
kasi ryo sampe takut begitu,Netral
minimal baca kak https t co exeppkhes3,Netral
nct bener hehe,Netral
no baby pose kyyu nya emang gpp tp situ riku bilang pose wichu which is jd marking pose mrk thats why ryo panik blg gaboleh krna sm kyuu dreamies hyung ,Negatif
lune sq nct mimpi dong atur aktif baur saja sider tarik rep gue si macan https t co jawiebqvkp,Netral
lu tbtb jurang ntar kalo kurban pake sapi wagyu,Netral
hei sq nct mimpi dong atur aktif baur saja sider tarik rep gue si macan https t co zpdyzgpaoi,Netral
ya allah kasi adek adekk,Netral
ken beli album nct wish tolong taliin,Positif
eh ga open dm si ternuata,Netral
wkwk hai cdm bub,Netral
doneeee mauuuu album nct dream hotsa  jungwoo djj boleee  maaciiii loppp https t co 1eodktyszp,Positif
jual qurban ga yaa,Netral
enggak gafollow base pusat wkwkwk,Netral
eh juragan sapi,Netral
sampe takut gitu ryo nya ,Netral
nct tuh c nya clingy t nya tantrum ,Negatif
bayangin sampe member nct nya takut netijen jari jahanam,Netral
 wtb  want to buy  nct djj parfume box jaehyun only -minus pc plss spa tau yg jual album box onlynya tlg dm akuu huhuu  mauuu bgtt https t co 50zlz07qu6,Positif
iya seingetku jg udh prnh kena hate mrk perkara pose kyuu inget ryo tuh fans nct aja tau mangkanya paham ga pose kyuu gitu,Negatif
nder bikin wichu pose pake kyu ngomong wichuuu ryo ngasih tau udah dream ga pose kyu pas capture time apa bikin trademark wichu nya it s okey it s okey,Positif
jaehyun nct haruto treasure jujur ganteng banget sih type aku,Positif
eh iya jw nct jg,Positif
mamah ku dger lagu jungkook bjirr trus ak rekomen lagu nct wrwrrwrwr,Netral
ryo newbie tolong ribut fandom ,Netral
tiket aja 5 juta nder,Netral
fans bocil past  dkit2 ngeklaimmm  pose gin doang d klaimmm,Netral
kaya jaehyun nct tgl tahun jg,Netral
baca yg nangkepnya setengah2 https t co h5hun6twsl,Netral
syarat masuk nct physical touch ya https t co 0bhlyxsucb,Netral
tolong up,Netral
wayv tk sgt la tp wayv tu lepak dgn member nct sumpah tu thn gk,Netral
aja file nct zone,Netral
mdjdkskxksllslsmsms mi bb el es tam nct fan https t co 6wldq9m3op,Positif
tp sumpahh kau nct dream dah skinship nct 127 dah peluk engkau tgk nct wish sumpah peluk dri content smpai hbis ku tgk peluk peluk je penat tp comel,Positif
juragan sapi,Netral
bilang fans dream ko ga fans dream klo km ga papa ga tau fans dream yg,Positif
gue ga pc nya anak nct ga ,Netral
ayo bang update nct zone bang gue bikin jeno kuping gin ,Netral
sm modal upload doang wkwkwk,Netral
need admin nyelem go nct diutamain nyelem ch kr paham harga pasar rajin drop jajan gak ilang-ilangan langsung dm aja ya oh iya trial 2 minggu gimana kerja cape nyari adm nyelem terus krna yg ilang ilangan muluuuu,Negatif
aaaaaaa nang bangett sampe takut ,Netral
ryo ragu sm takut sumpah sedih bgt anj,Netral
yu sirik  ,Netral
bukan ngmgin nct ,Netral
bener2 unit bontot nct yg clingy bgt gemes yaampunnn https t co cxbgd9oxqp,Netral
kalo tau sm kerja fir,Netral
juragan sapi si,Netral
ryo tau woi hiksss muka ryo ktkutan hiksss adekk kmu bnr bnr darah ijo ya,Netral
takut,Netral
ho oh tp ga tiket nct murah anjer,Netral
gw ada wangi mobil bentuk nct gin nda yaudah beli bjirr gilir gw kasih unjuk bau nct langsung diiyain mulu gilir nya ngapain beli kaya gitu ,Netral
gin tuh si nct tuh gendong ,Netral
moon galau nder ,Netral
bubu first love gue nct sohee jugaakkkk first love riize tambah antonnn sayang gue jugaa skajskansn sayang bangett yaa ama guueee,Positif
wkwkwk,Netral
does nct dream own the kyuu pose ya emang anjir mereka lu cari aja idol yg kyaa kyuu kyaa kyuu kaga bjir dream doang,Positif
hah y ampunnnnn knp d hujat bjir org2 korea aja yg warga tuh jg aegyooo jg kyuuuuu,Netral
astaga gw si nct nation gabisa nih diginiin,Netral
ryo nctzen tau yg fandom ini,Netral
gak sabar nungguin weekly idolnya nct wish seru banget deh ini  https t co kfveot54px,Positif
ryoooooo gapapaaa sayanggggg idol yg minjem gapapa kok adeknyaaaa huhuhu tampar sih ini liat sifat si ijo akwkwlw,Netral
hati fell titip salam kalo ketemu nct hahah,Netral
busett ampe mikir bgt pose doang liat nih hasil fans toxic tdk,Netral
buset kak pelan-pelann https t co kdfcorfm2i,Netral
ahh baby don t worry we love you too misi abang jaemin emang sebar kuuu kuuu penjuru bumi gapapa pake itu,Positif
gapapaa adekkk,Netral
tp jarang up akun nct wish g sih kak soal nemu 3 video challenge aja foto jarang yg bikin yg mikirnya kayak gitu,Positif
dek gapapa dek,Netral
one of the best home gelar mereka nct 127 exo they saving me  https t co b4pfxdepnl,Positif
resmi debut nct wish cupid super gemas mv wish https t co ynubl5sw3r,Positif
aaaa sedih bgttt,Netral
ih gapapa de ga no hak cipta nya ko gapapa gapapa,Positif
adekk lucu banget ,Netral
yusirik banget heh onriyu aja atuh estetip ,Negatif
lee jeno tampan sayang ,Netral
bjirr faktaa terang benderangg,Netral
u gpp tp yg papa udh hujat jg hati2,Netral
kakkk pink christmas nct 127 sealed avail 4pcs yah dm ajaaa,Netral
gua dreamzen gk ap2  lgian kyuuu udh dr jaman jg idol2 sring gitu,Netral
ryoo lu udh nct jugaak gitu si ryo tau kali ya orang ga waras wkwkkw,Netral
mandiri bener yong semua-muanya yg punya,Netral
yak yg ganas ganas gatekeeping pose kyuu gitu ya anak tau pose sampe bikin jd takut gin udh parah berat jan jahat smaa wishies yaa,Netral
bngt,Netral
guys yg msh ajar nyiapin budget ya konser tds3 nct dream nanti only tiket,Positif
satu frame nct temen gw nctzen hehe ,Netral
aaa pdahal nct ihh gemoynya,Netral
knp ryo gk ap2 kok kyuuu jg udh dr jaman gitu idol2 jg sring gitu d sruh aegyooo,Netral
gapapa adek gapapaaaa  awas aja sampe hujat salty adek wish ku hantam pala nya tu ,Positif
kena hujat dream st an kak ktnya kyuuu tu garis keras dream,Positif
sion kaget nnti pda nanyain harga hewan qurban ,Netral
hei dengan mark lee sini ajak kawan barang kawan dengan beri hadiah  bagaimana minat kawan dengan anggota nct https t co wulcj4citx,Netral
cukupla buang lagu nct nation movie bluray pon nak cut jugak ke,Negatif
orang reaction mv nct wish aja bilang ngira make muka sakuya,Positif
nct tuh latih latih utk clingy kaaahh nempel bat ya kl konten,Netral
yahahahahaha kirain toksiknya indo doang sampe bahan dunia mana,Netral
sms wts photocard doyoung nct  ready kirim  tangsel,Positif
pls juragan sapi tpi duitnyaa,Positif
jaemin kyungsoo pokok bias2 gue nct exo svt and ofc lee know gue biasinnya pas gue lg gasuka sm siapa gatau dah pkoknya gue hrs ketemu sm sohee,Netral
sedihh sampe takut gitu ,Netral
woi gw sion,Netral
fans gausa norak,Netral
aplgi solo bg hmhmmm,Netral
iconic moveee ma motion aja,Netral
gapapa sayang abang jugaaa gapapa dekkkkk yaallah sedih ,Netral
jg kaget degdegan takutt ,Netral
nct wish yg dewasa sion emg,Positif
huhu adek,Netral
tolong jahatin anak ini,Netral
240229 jaemin nct dream weverse post  tgl 29 4 sekali senang gak sisa czennie cepet tidur yaa nctdream  https t co bxhhnihctg,Positif
wtb jasa jual pc ww ina nct drop tnc zonajajan,Negatif
ni dijelasin sampe unit nct q gara-gara pas live dream battle kyuu renjun vs jaemin https t co wmtffbiq8f,Negatif
siniee lgsg join go ku nder bsk lelang pc nct start dr 2k aja  https t co ejks5lastm,Positif
gapapa dekkkkkkkkk ya allah sakit ati gue,Netral
dz tau bgt yg ngga toxic tolong kalo yg toxic dikasitau kalo salah,Netral
nct zone kakkk ayo downloaddd wkwkw,Netral
taeriah carey,Netral
p banh  nct dream beneran comeback ya,Positif
ngerti,Netral
ryo nctzen udah paham kalo takut hujat,Netral
nctzen yaa mungkinn yaa mungkinnnn tau sesuatuu pdhl sbnrnya gapapa udh nct ,Netral
shit down by nct 127 asa keren bgt kalo dengerin ,Negatif
kak nggak blh jujur banget kak ,Netral
aduhhh gw maaf sedih bgt maaf ya adik-adikkuw,Netral
sederhana nct dream gabisa keburu marahin injun yg ada,Positif
kena gimana kak,Netral
inpo loker ngarit donkkkk,Netral
kasih sender lagu antar tidur nct,Netral
sedih krna liat takut neng hati ngejaga grup nya keti keti jahat makasih ryo,Netral
nanti buah manis juga langkah sukses selamat debut nct wish harap doa serta jalan karirmu https t co ebazkef90e,Negatif
