wls malem kuy yg lg cari pc nct dream kms fs 2 0 ver 6 mampir  adagonya start30ribuan ajah domtangerang,Positif
gw dreamies udah bakwan sayur nct wish lebihhhh kaya lem bocil bocil lucu bgt peluk terus https t co 9xhcjvzzle,Positif
nggak sih berangan anggota nct wkwkwk,Netral
kalo juragan sapi yg mah gas,Netral
lirik gambar member nct wish mrka wish bilang buka mata dunia ubah up and down we re another one sesuai konsep dlm video nct - dream contact our wish dunia yg up and down wish not nct wish https t co dzpdou3lwc,Positif
laris manis idul adha,Netral
wtt uang nct zone tiket konser iu nct dream https t co xyiogotryn,Positif
keren keren bgt sii do0 nct girl ,Netral
psell malem kuy yg lg cari pc nct dream kms fs 2 0 ver 6 mampir  adagonya start30ribuan ajah domtangerang,Positif
luar prediksi bgt klo sion koko pengembala sapi ,Netral
sms malem kuy jajan fanmade doll nct     clothes cover neobong  req utk doll cheetah gomdo tojaem jaeminbun wangjjen kongjjen renmyang dll https t co c2kjpp9ndp,Netral
favorit collabnya tvxq x riize suju x nct wish collab little prince ryeowook x sohee bikin merinding ,Positif
ya allah dah pusing ngurusin dang manusia jepang yg lulus jft ssw nyaaa  udah tau skrg war jft ssw udah kyk war tiket coldplay calo jg kalah dah war tiket nct ,Negatif
pls butuh,Positif
tau ka nis tp klo liat outfitnya kyk pc nct nation,Netral
wts  want to sell  help rt photocard bts in rush bu  jaksel  exc pack adm co freeongkir condi dm wts ready ina bts  wts want to sell buy photocard postcard only bts nct dream dll namjoon seokjin yoongi jhope jimin taehyung jungkook https t co ddf68t2mkr,Positif
ih udah bgt nct ga kesini yaaakkk ihiw unit wish perdana siniii,Positif
kalo doang,Netral
yuta hancur maju sedih suara latih juang ulang capai suara ideal ingin senang sulit untuk,Positif
nct wish c-nya clingy wkwkw ryo adekk ingett sakuya kau bayi dedek  https t co bhm9wy85kv,Positif
gakk sabar lele cantik bangettt  https t co xkvcwxrn7r,Netral
cekel ambyar,Netral
trus seller nya nanya gw nct chilzen dreamzen gw bilang haechanzen wkwkwk haechanzen bikin solostan,Netral
nyari photocard haechan murah riah bersih ina ikut warnya besok malam ya ges tags wts photocard haechan sg24 istj haechan boneka lfb pc haechan nct,Netral
anak nct dream,Positif
asing bbgt sm tiktok nct gw ngk tau member yg ituuu knp ngk pisah akun aja sihhh bikin unit lbh enak,Netral
wehh busett ga nyangka idol melihara ratus sapi,Netral
gk tarik nct wish karna isi pda dede gemes tpi pas fyp mv jdi sukaa mv nya lucuu kengen era ngekpop idol mv nya cerah gitu cerita nya lucuu bentar ya xodiac kok,Positif
tikk,Netral
cdm ya kak,Netral
gk bayang sultan juragan sapi ,Netral
kaya ginii kak kek beomgyu txt jeonghan svt jungwoo nct wonbin riize soft kalem kuatt asdhklfsjaj https t co wcuvec6mib,Netral
udah dislepet taplak meja makan renjun nct belum,Netral
wkkwkwkkw momot,Netral
kek anak nct kalo sekali ba gba tuh jiwa bgt deh brandnya sumpah,Netral
jaemin nct tua hari doang,Netral
iya bener suami saya,Netral
ga open dm kakk,Netral
ilangin teks,Netral
wts pc dcon nct 127 bisa bisa co oren  dom jogja  dm aja harga spesial take all wts wtb wtspc wtsnct wtbpc zonajajan https t co 1wtwvoo5al,Netral
wkwkwkkkw,Netral
akuu,Netral
tuh nct nation full ver 1 4 doang kek tayang bioskop https t co yejkwuxsve,Netral
rawat sapi sapi mu a senang hati,Netral
ayoo alih pikir nct aja yuuk pikirin hal2 Negatif,Netral
kalo bias nct nya mark bias riizenya sohee bukan,Negatif
wes setip tisu tisune teles pis wkwk,Netral
fake maknae nya nct dream https t co hluchqe0cg,Negatif
asli cerita kaya gin pas suju rv nct ada,Netral
alam kejut dengar suara kali yuta trainee rekam ruang rekam biasa uji beda nyanyi ruang latih eng,Netral
kwkwkkw manusia sabar setip tissue,Netral
nct zone heran play bjirrr,Positif
jaehyun nct siehh ngl cakep nya ga ngotakkk ganteng tuh ga bikin bosen ngerti ga seih gua naksir pesona tetep cowoku mark menang,Netral
nct dream udah clingy ternnyata wish clingy ,Positif
sedia game bot ayo buru join ramein gc nya join lupa baca pin amp rules gc ya sengkuu batas line 05l tunggu pacar sayang jisung,Positif
nct open member    halooo nctzen ot26 bukan nyari gc nctzen ya nih cety opmem deh member nya asik event seru ain cont,Netral
trans 240229 yuta at home radio op dulunya main dj radio op rekam dengar suara op kali menang kenal yuta bilang lucu orang yang https t co xcln6vzvbf,Netral
jaehyun nct ganteng banget tp maaf kepincut,Netral
adik ika kanak kanak istimewa and minat nct jugak bias johnny mark ika  apa adik  kerja sekolah ika  kerja sekolah nama taeil haechan  adik  moon sun  https t co 7fbylbev3f,Negatif
sorry nder udh kebel enih  https t co b2k15510eq,Negatif
nggak salah emang leader a whole nct,Netral
wibu bikin sayang bngt https t co daqkamj09l,Netral
emg anggap nct ,Netral
yeuuuu make nanyaa,Netral
ajak jisung yuk ,Netral
udh sembuh top up an ml nct zone,Positif
besok kak paling udah jam pulang kerja soal gak lembur adminnya,Netral
aduhhhh rambut riku alus ya ryo trs pipi riku empuk ya yushi ikut jd member nct aja ya biar elus riku sm buka recruitment nct versi cewe ga https t co yrr5ovpmi2,Netral
yaampun bgt nct zone card steampunk hikssss,Netral
kak foto lamaa,Netral
gue udah gak harap taeyong leave sm ma nct,Negatif
mw pc nct resonance bleh dm qkwokaoqkakak,Netral
ingfo harga album versi boneka gemash nct wish,Positif
besok kak,Netral
anjir liat yuta jamet pesona pria well done sihhhhhh,Positif
ngeliat nct wish clingy gitu ken gabung beneran kayak anak kucing semua,Positif
nct mari streaming ugal ugal-ugalan amp beli album kalo mungkin amp like share konten tap platfrom apa amp ugal ugalan pre vote  tolong kerjasama sijeuni ayo kasih menang leader  https t co vf2fkwrltt,Positif
nanti buah manis juga langkah sukses selamat debut nct wish harap doa serta jalan karirmu  https t co u6ikshyb4n,Negatif
harta tahta nakamoto yuta ,Netral
renjun gw sampe bilang gin nonton nct dream tv lho cowok semua cantik pas renjun shoot gw kalah cantik renjun,Negatif
gak laku slb anak autis ,Netral
layout pake foto dong cantik,Netral
sewa rumah gas kalo nambah meja nct tiny apato muat ,Netral
ganteng bangeetttttttt huwaaa,Netral
  part 3  another lightstick nct  random photocard secured ikut po yaap sold web  https t co xzqvyulrcu,Negatif
nct wish n nya nemplok nemplok sana nemplok sini bikin yg nonton pgn ikut nemplok,Positif
sapi qurban bang,Netral
galll  isi tas yg mini alias dimuat2in  https t co ebtkxdnhem,Netral
240229 tik tyong tiktok   taeyong  nct  https t co gpu3agumsn https t co weicniztad,Netral
today mail s  pc nct 127 from  kaget banget isi berat dapet freebies thank you kakk pc nya tambah koleksikuu salfok yuta ganteng bgt moga bahagia kakak pas unboxing happy sekali https t co anfxv6adv1,Positif
yuta rambut pendek pakai outfit formal rapi ,Netral
jaehyun nct ganteng bangettt pelet blom nembus,Netral
kmausta ok ka pa ba,Positif
mjbbb kalbarrr,Netral
cung ayo cung ikuttt,Netral
soal hadir riize tunggu ini fans shotaro jelas karir taro jadi biarpun shotaro riize buat shotaro amp riize junior nct agens,Netral
gue putus keep memori nct 2020-2021 gak dukung riize anggap riize unit nct beda nerima hadir riize gampang kenal shotaro dulu riize bahagia,Netral
bjirrr juragan sapi,Netral
mbaaa hati hangat banget sumpah  neng banget orang tulus kayak syukur fandom ,Netral
gk konten nct dream comeback kan,Positif
sms  jajan go nct wayv yuk  admin nyariin wl loh drop jajan langsung harga ina join go nya yuk join 12 0 2250 450 130 16 0 bandung link  https t co 0a57wwmtzm,Positif
susah bgt buset jual pc nct skrg hadah,Netral
kaya anak nct rata2 clingy ya,Netral
open sharing tumblr nct dream sfxcinema thailand  udah wh thai  ready 25 3  est 300g bersih ina harga set 268k dp 180k jeno jaemin 235k dp 150k haechan mark  renjun  180k dp 80k chenle jisung tumblr only 55k  t wts po https t co immronr6ge,Positif
mentang mentang demen nct dibeliinnya ijo  https t co usgyd3j417,Netral
hahahaha halo heyooo gmn masuk circle diospek yh lagu nct,Netral
bts - jungkook zb1 - hanbin hao nct - jisung svt - hoshi wonwoo skz - hyunjin ateez - san txt - yeonjun p1h - keeho intak monsta x - 8turn - yoonsung tbz - juyeon bnd - taesan jaehyun woonhak enha - riki,Netral
yuta bilang beli barang op sulit tolak mari tolak eng  neocityjpn ,Netral
kalo lebaran gk pusing nabung belli sapi tinggal qurban aja sion,Netral
kalo kaya gin restu,Netral
sumpaaa buyer ku jga yg gin and jual pc nct dream ,Positif
nct c nya cute 26 member doyan aegyo semuaa ngecap cute,Positif
juang lawan insercure overthinking sampe ujung susah tidur well donee your homee nct cowo yg pegang omong,Positif
emang juragan sapi cakep ini,Netral
halo teman2 tinggal jakarta beli merchandise nct tolong isi kuesioner ini thank youu https t co amxnhuow05,Positif
maksud si sion juragan sapi hayday,Netral
udah bgt gk nge nct zone an ,Netral
gaada plis dimasukin jaehee nct wish coba cek laagi papa ue ye nang ,Positif
gemas nct wish ini https t co zysbmkl90d,Positif
sms rekomendasi go nct wayv dom jabar nihh udh open sampe go 3 loh trusted  rame banget jajan  rame coret  join go nya yuk join,Positif
cowok ya tulus aku kaya gak deh yg tulus aku but nct sini im here makasii berkat gak psikiater https t co icmyfwgaew,Netral
trans 240229 yuta at home radio  op coba pakai toko bagus kira yuta alami op coba baju rumah bagus toko jadi op terkadang bisa https t co ymb1fv8roo,Netral
ga hana aja the name is so pretty,Positif
gue mo dtgin center 4 trs gue upload konten nct yg mrk anggurin anjgggggg,Netral
galau maksimal butuh nct dream,Positif
moga nct sukses nggak udah tu gak repot repot bongkar pasang member udah wayv moga cepet kasih world tour,Netral
siap kurban ,Netral
gunwook nct wish,Positif
mark hci nya gak kak spil,Netral
riku yuta bgt dahh,Netral
ken jual pc nct ku,Netral
kris gak ajak ihhh lee taeyong taeyong nct ,Netral
gak kaget dah tau arah,Netral
sion cocok banget kayak gapapa deh berondong ntar sapi digabungin biar,Netral
ayan na ayan naaa ang bagong love team,Positif
wts yg mas cari season greeting nct dream 2024 kah avail to take member renjun chenle nih ak jual underprice kalo yg dm ya langsunh co shopee  wts want to sell nct dream zonauang zonajajan https t co amunmgkzmw,Positif
juragan sapi tah ,Netral
mark garis rad ,Netral
galau berat kangen nct dream,Positif
nct hyung linenya wish aka yusirik lucu banget hiks https t co 1y9f8qbav8,Positif
bin liattttt lu bilang lucu leader pusat nct ,Netral
lucu bgt ,Netral
kangen bgt nct weedol,Netral
sms wts ready kirim nct 127 mark japan exclusive cafe barista under 200k yap cashback 40k langsung cek tweet bawah aja,Positif
wts ready nct home game set 75k - jaehyun shotaro - hendery yangyang polaroid a 65k pair member a harus pair b jaehyun haechan mark renjun hendery xiaojun  b taeil shotaro sungchan yangyang kun ten chenle polaroid b 65k pair -sama pola set a https t co i2055hdkis,Positif
wkwkwk yeyy udah apal duluan kalo nct ,Netral
wkwkw juragann,Netral
mbak gk skalian keliling indo juga jaminnn tuh kaki udh gak bentuk,Netral
rill adek2nya nct,Netral
cakeeuupp bener bang https t co vdrvasvyn1,Netral
di-postingan nct sebenernya 9 postingan 3 member nggak 3 2m ntah hitung gimana,Netral
nanti buah manis juga langkah sukses selamat debut nct wish harap doa serta jalan karirmu  https t co jnzzq1f5va,Negatif
moga nct kenal kalang yg sayangg nama nct dapet awards aamiin kaka2 moga mudah urus lancar2 giat rezeki yg penting nct kakak2 moga sehat bahagia ,Positif
kau jadi pa kau astu lari cari stylist salah masuk bilik nct tu la cinta haechan putik,Netral
lune cari renjun chenle jisung lengkap gdm nct dream x aespa https t co efqmjf5sz7,Positif
hrus bgt milih,Netral
iya ya klo ga orang kaya ya orang kaya banget hidup mereka nyata ini,Netral
postingan dah rame gbs edit tweet diapus sayang kah mint edit yg ig nya doang please include jungwoo in nct brands he s ambassador jungwooxtodsfw24 jungwooxtods,Positif
jaehyun cuuubanget ,Netral
nct wish gemec bgt printilannya ,Positif
bayar nih ,Netral
hhhh harap perintah bang  aja aibuk sana lantik lantik itu naikin jabat itu sibuk nata kota duit gak ada pikir daerah bener bener butuh,Netral
haas alpine kacau bro kick sauber livery nct gojek gas elpiji aja masak mateng ,Netral
gaboleh pilih pilih nder smua nya kalo aku,Netral
  open po  go ina  nct wish  wish - single album details wichu ver  smart album  keyring ver   315k pcs dp 265k pcs est 100gr  close po 3 maret 12 00 wib  express estimasi 5-7 kirim korea  lunas via  https t co pfqig0xdlb,Negatif
wkwkwkwkwkw memangggg banyakk yg gereget kokkkk hahahahahahahahah samaa samaa yaaahahahaha,Netral
mari bookmark biar nct full team manifesting ini,Netral
ga ada konten nct malem ini sedih,Netral
nct akechi omg,Netral
official 240229 tiktok amp instagram reel update sion amp riku  b o o m s h a k a l a k a https t co eh88jndigp https t co lmltuvndpm nct nctwish  https t co wqu7cwfdwt,Netral
riku nct wish seohyun snsd,Positif
siap idul adha ya sion lumayan kalo jual nyari tinggal jual pasar hewan,Netral
noh mayan dapet tanah gratis bejibun d g yg jg n g udh rebut tanah palestin jg,Positif
wadidaw anak juragan sapi,Netral
seakin ga nonton weekly krn anak nct udh ga kesini lagi kaget mc nya udh ganti ,Netral
buset gila cakep bgt anjrit,Netral
qiqil si koya ,Netral
nct dream sumpah ga gede gede dah kasih konten tiktok kek gitu,Positif
yhh btull nct dream - hello future yahh gess tp pake logat koreya xixixi ayo hitung poin next 20 25 https t co ncfgf7juew,Positif
wts pc nct dream nct 127 ready ina  bekas kota  ready co 3 3  vidcon  freebies  no hnr take dm komen ajaaa wts pc jaehyun wts pc aab mark wts pc aab renjun wts pc aab jeno wts pc aab haechan wtb pc istj wts pc dad nct dream renjun golden age pc kyungsoo https t co nvx4iaarif,Positif
bujang2 nct pernah pas liat pov doang,Netral
si per utama perempuan lempar koin air mancur cupid air mancur dewa cinta yg dewa nct wish dlm wujud ethereal https t co c0eszlrgzj,Positif
yg thread live translate nct wish yg gasih,Positif
username debut nct kayak yg make,Netral
help rt wts  want to sell lightstick nct  550k nego spaylatter akulaku cod jakarta venue tds3  dipake noraebang 2x jakarta  co 3 3 keep with dp no scammer hnr yg dm aja yaa feel free to ask https t co v74hf4jqne,Positif
wkwkwk bang biarin udah mah aneh kalimat sebenrnya angin ktp angin tuh kasih kartu indentitas  kasar cuaca gak prediksi suasana iklim dunia biarin bang oranv bodoh lawan susah,Netral
amp bintang rang keluarga bintang malam terang suho exo ft nct dream au https t co 1qev9upl0k,Positif
idul adha nitip sapi 1 sion dehh,Netral
liat anak nct weekly idol https t co m1okx6gqlm,Netral
besok idul adha sen die aja ya skalian jaga tali silaturahmi dgn calon mertua,Negatif
nct nih cari birthday kit renjun sender rekomendasi nihh yuk poin siniii pilih package beli satu nih yukk yukk merapatt isi formnya ,Netral
punten teteh ngeteh teh  ijin ihirrr sapa tau rejekinya ngga duit bagi bian skala mangkok sm mang ajay  my february boys tuh kalo si teh kak doy yg kenal nct ihirrrr trs yg si ganteng jagat raya bang jaehyun  hatur nuhun https t co vgajmxqbb6,Netral
oalah,Netral
lucu banget anak bobo,Netral
njiiir sapi korea tuh mahal bet lpoh,Netral
wtb open po album nct wish dp nya rendah or nyicil tags wts wtt wto nct wish,Positif
fanmeet ayo member nct yg ga wamil fanmeet jg hihihi,Netral
33 nya dong,Netral
gue pas nct https t co e8ua0jjsat,Netral
adek lupa ingat  jaemin 00l nct dream three tweets au abaskarasquad https t co lsxisffkdi,Positif
ayok temen stock seller nyaa tip langsung dm kitaa ya habis wts wtb nct wish sion jaehee yushi riku ryo sakuya,Positif
bohong ganteng kayak gin yuta pacar kannn,Netral
tanda keluar nct smrookies trainee nama ji hansol ga kabar debut nct udah agens,Netral
cantik manis bgt sayang,Netral
moga nct wish konser indonya pas gue udh hasil 5juta hari,Positif
suka nct  kantong kering tiap aja beli,Netral
ihh tolong capture twt beneran manifest nct u ab line,Netral
nder ,Netral
bener2 gua gangerti updatean baru nct zone infinity tower langsung main2 aja ngereset kartu,Netral
selamat riii lanjut hapal member nct,Netral
kembang pribadi artis sedih tur akhir yuta bilang momen arah depan habis senang gemar eng  neocityjpn ,Netral
klo tiga pilih,Netral
smwany pesonany dh mnmbus tembok bda agama nder ,Netral
anak sahabat gweh kaya bias gue taeyong nct,Negatif
nctzen sukses doang nct,Netral
mais nct ptn,Netral
hi sakuya congratulations debut nct wish kemarin yaa 3 absen udah bangun cinta crushnya saran next bangun ya,Positif
lupa speaker nya cas ya mba,Netral
yuta 127 kati tur konser hidup ekspresi bagi rasa ini konser rasa eng  neocityjpn ,Netral
wts pc nct 127 avail mark yuta jaehyun doyoung taeyong  pob be there for me  ready kr  go line  bersih ina  tax  full  pair ya go dom jatim sumbar kaltim wts taeyong jaehyun mark haechan yuta johnny jungwoo doyoung https t co 9mx6zhh3ct,Positif
video gak kak,Netral
alat ngedije zenofm zeno nct,Netral
nct berani urus engap pusing la  disatuin nct u tuh sedep  pake vocal haechan rap mantep nya riku plus rap with deep voice jaemin aduh wanita menang mah ,Netral
suka tengok interaction leader nct dgn leader zb1 taeyong cakap hanbin cute tpi taeyong pon cute jugak geram nak cubit ii,Positif
donk  https t co fno2arpzdm,Netral
warna ijo nct,Netral
mbak guna sm ,Netral
trans 240229 yuta at home radio  yuta bilang tur dome ke-2 nct 127 tokyo hadir yeayyy kosong besar terima kasih tunggu isi venue sebut terima akan https t co eg9ouxsfck,Netral
sungchan pas rambut tuh emang cakep polllll pas join nct jg udh nyuri perhati gue sih ,Positif
iya bener cowo nakamoto yuta,Netral
hallo need admin nyelam ch jp salah satu bolehh go nct - rajin drop jajan - fast respon amp ilang ilangan - alam - tau harga pasar - sibuk amp free - tanggung - ramah amp jujur yg serius mauu dm line yaa zonauang,Positif
milih suka tiga,Netral
burik clingy bocil nct wish yushi adeknya ga kabur https t co fzcwzjhrcl,Positif
gw bilang jaemin nct bjir,Netral
beda hari ama taeyong nct,Netral
gimana ya masuk list bias lagi,Negatif
cari kipas tangan nak bawak pergi konsert jumpa nct dream kipas haha lenjan je la kipas tangan jicung tah campak  https t co gdycxhyvbd,Positif
salah primadona nct https t co lodjllhgup,Netral
merch jepang nih dvd nct nation gt harga jepangnya aja set udah juta  jd bayang brp harga pas udah yos,Positif
ihhh ryoo ku usek ya kamu sakuya jugaaa gemes banget aih,Netral
open rent samsung s23 ultra amp iphone 13 xdinary heroes 02 mar yoona 03 mar fancon chanyeol 09 mar nct dream 18 mei  konser lain testi yg semat yaa price amp tnc dm me tag wts wtb wtr,Positif
nct beneran gak drop gitu kek gue puyeng banget,Negatif
nct wish lovelangnya physical touch ya ,Positif
chanyeol ong jeno xiaojun jaehyun chenle doyoung mark jaemin mwoya nct hunter,Netral
nct jaya jaya jaya ,Netral
cakep banget cowoku ,Netral
kalo 1,Netral
gempur md ga main2 ya semangat nct stan,Netral
ryo sakuya tu ky ngeliat renjun klo gemes unyel jisung sampe adeknya pasrah gtuu,Netral
lucuu bgt ngelendotnya kek gemesin bgt,Netral
sm kaya lucas bukan nct,Netral
kalo mahh merem ga nyasel,Netral
mngkin maksud nct dg dg si doy yg wakil dr nct tp jungwoo gk ya dia wakil tod s,Netral
kuy po jajan by nims po album nct wish- korean ver yes24 apple music - photobook ver 300gr  250k dp 150k - keyring ver 100gr 370k dp 250k booksloot 50k pb booksloot 100k keyring ver close  tba  estimasi bersih ina  packing https t co zwsvkzt8kd,Negatif
nii nct dream po https t co ynqqwwbq8f,Negatif
udah bener say posting akun nct brand nct masuk hitung salah gak masukin hashtag nama jungwoo tweetnya,Netral
nctzen hanbin bilang kiyowo leader pusat nct,Netral
po album nct wish- korean ver yes24 apple music - photobook ver 300gr  250k dp 150k - keyring ver 100gr 370k dp 250k booksloot 50k pb booksloot 100k keyring ver close  tba  estimasi bersih ina  packing,Negatif
juragan niih,Netral
ryo akun priv ngehype nct yah,Netral
selagi milih,Netral
u kakak moga limpah rezeki slalu sehat keliling orang baik u all member nct moga sukses amp karya nya kenal orng thank god amp the universe for giving me a chance to live in the same life time as you guys let s be happy together,Positif
yg barusan ngabarin  https t co bda2qyonfs,Netral
tiny cupid uwu,Netral
wowwwww jaeminnnnn,Netral
po album nct wish- korean ver yes24 apple music - photobook ver 300gr  250k dp 150k - keyring ver 100gr 370k dp 250k booksloot 50k pb booksloot 100k keyring ver close  tba  estimasi bersih ina  packing,Negatif
keluarga sabi alas ceria adek jisung ft nct dream amp baekhyun few tweets au https t co phuwggb5zp,Negatif
nct dream kak pob nya aja kak,Positif
rekomendasi tumblr botol minum  -- a thread notes  hun renjun joshua paket d zayn malik mahasiswa hotman paris uu ite andara henry 17 agustus atlas bal nct jaemin jaehyun mark https t co h7oonnstqg,Netral
jaemin haechan jeno mark jisung jaehyun winwin nct,Netral
dapetin e-money total rp250k yuk sebut nama tour konser ke-3 nct dream gampang banget reply kamu serta hashtag gueboncabe tag 3 teman ikut wajib follow gas ikut juga tunggu tanggal 13 maret 2024  https t co w13fkg5lt7,Positif
liat bayi ngebayiin bayi nct https t co mlsfqekk9j,Netral
anjir bang ganteng bgt,Netral
mcd tgl 7 hanbin jaehyun ketemu nct wish,Positif
darimana aja,Netral
in her nct 127 era ga lagu svt mx rv ,Netral
knp jd akun nct yg muncul aneh bgt,Netral
tumben bgt tangan wangi wkwkwk draw lgsg 2 ssr jg dapet ssr jungwoo tp ga sempet ss event zonk mulu  nct zone my luv  https t co p0plbscujr,Netral
ryo aware bgt kek perfandoman krn tau tbtb suka antem grgr disensitifin konteks nct wish live trs capture time trs suruh fans gaya kek kyu gt beda nama trs ryo bilang itu sunbaenim gak sih jangan huhuhu my baby,Positif
anjir juragan sapi,Netral
liat enihh abang yuta,Netral
njirrr cakep bgt,Netral
semangat atmin cabang tiktok ,Netral
nih beli hewan qurban sion ,Netral
open order bubble nih aktivasi panjang bisa order wa only yg bio yaa wts wtb bubble lysn jyp star s cube ist wm lucas jaemin jeno mark haechan nct 127 dream wayv ive super junior stray kids aespa minju itzy zerobaseone day6 zonauang https t co tl8npml0v1,Positif
iya pcrku,Netral
bisnis raya kurban nder,Netral
cowoku ganteng bangettt,Netral
sion nnti ngarit date ya gw jg domba,Netral
lefty tods under nct ya tods under nct kalo jungwoo heheheh,Netral
lagu nct ngiang nama broken home ya,Negatif
perempuan ngejatuhin harga ngetik kolom komentar orang heran banget sampe ngetik apa2 banding orang jatuhin,Netral
adek   alien-alien  ,Netral
29 2  ges nanyaa 29 2  grup boyband korea yg kenal sii 29 2 k 29 2 k bts nct seventeen exo straykidz treasure enhypen riize 29 2  bukann ituu grup hts ya 29 2 g   29 2 k bangsat gua ,Positif
lohhh akun doie sakit nggak keitung kah pke nama nct,Netral
aahhh iyaa aktor thai  fanboy nct diaa,Netral
inihh pdhl tods masuk brand nct tp jungwoo ga,Netral
nct wish did kyuu omg ,Positif
hahah lol pose kyuu kaya ryo not kalo kyuu identik nct dream,Positif
cerita bias nct ketemu bias riize ,Negatif
240229 ten easy challenge le sserafim s yunjin sakura wayv https t co obea4jvzeo,Positif
lagu debut nct wish - wish lagu turut emg rasa sih pasar jepangnya ga ngejelasinnya tp rasa klo lagu tuh tipikal japan music tp neo music nya jg asa banget dgr pas smtown ckup suka tp blm ngena,Positif
wkwkkwk lawak nct wayv,Netral
gantenh bener daahhh https t co lg4250erfs,Netral
jaehyun nct when challenge bareng sakura,Positif
yg buka album nct wish photobook version gasih,Positif
lowkey haji dagang sapi idhul adha,Netral
tiba pikir glukoneogenesis  glukoneoculturetechnology  maksud gin glukoneogenesis  proses bentuk glukosa karbohidrat glukosa bikin atp energi tubuh tp sumber karbohidrat yak nct,Netral
nyala johnny kuuuuh ,Netral
nct sungtaro tuh putus baik bayang mulu https t co dsoktnxoz4,Netral
only pob nct 127 - ay-yo apple music 360 https t co fk8hybnzjk wts lfb ph ls sco dc10 nct127 jaehyun taeyong haechan mark yuta doyoung jungwoo taeil ld pob selfie selca poca pc photocard appmu apmu am appmus btfm https t co eepxinjyf9,Netral
only pob nct 127 - be there for me apple music 450 https t co fova3gfa6p wts lfb ph ls sco dc10 nct127 jaehyun taeyong haechan mark yuta doyoung jungwoo taeil ld pob selfie selca poca pc photocard brfm appmu appmus apmu am https t co gckutriogz,Netral
240229 ten legit challenge ini s jin wayv https t co 1cpumkjuaq,Positif
makasih sm udah putus masukkin sakuya debut line up nct wish anjir ni bocah beneran bawa warna nct wkwkwkwkkwkwk,Positif
nangissss cantikk bangett princesss,Netral
unreal,Netral
gorgeous ethereal ya pokok indah semua,Positif
buka po nct wish keyring,Negatif
sangka jd juragan sapi,Netral
effort nya ngga main main,Netral
 240229 nctwish tiktok amp ig reel - sion riku  b o o m s h a k a l a k a  https t co iw9glgwxxa,Netral
jujur anak nct gue kepincut jeno ngga,Netral
kalimat bukan  https t co itgldcabhj,Netral
idul adha laku nih,Netral
alas sakuya milih lirik dijelasin video interviewnya nct wish oricon bilang lirik gambar this is the beginning of excitement sih daya tarik fujinaga sakuya pikir tu tarik  https t co 7ip1eaidfu,Positif
nct wish lucu lucu yak cimit cimit,Positif
yaallah bikin tren do0 nct girl album majalah malanggg ,Netral
emang si babi pink fokus favorit nya si agens gue ngestan unit nct yg bikin sakit hati tuh ya wayv njirr udh debut kaga konser mulu ,Netral
sumpah ya md2 nct tuh ampe h brp anjrot md mulu protes tp beli,Netral
psell haloo yukk jajan aab photocardd nct cuss dm,Netral
hi sijeuni yuk join gc https t co ugcpasp2mb lgi ngadain giveaway loh tpi kalo join giveaway nya dah selesai out ya ramein nih gc gc nya seru loh kadang konten jga giveaway nct nctwish nctdream nctzen https t co odj2ytjyef,Positif
pasok susu cimory ya sion uuuuu,Netral
