itulatuu diorng lupe diorng nct jugak,Netral
gais liat mana form applynya yg linknya gakk,Netral
kan gamungkin seimut jakarta cmn kasi hari,Netral
haiii kak,Netral
if u see this qrt w ur bias from each bg bts - namjoon seokjin yoongi hoseok jimin taehyung jungkook zb1 - nct - jaehyun svt - woozi hoshi skz - felix ateez - txt - yeonjun p1h - keeho monsta x - 8turn - tbz - bnd - jaehyun enha - jake,Negatif
open jastip md japan nct 127 3nd tour the unity  bersih ina  grup order  tax and shipping  direct ina 4  dp 80  lunas via shopee jakarta dm for fix order tags taeyong yuta doyoung jaehyun johnny haechan mark jungwoo https t co ylxjnr8pwc,Netral
nahkan ,Netral
anjir idol juragan sapi,Netral
yujin habis denger lagu nct dream jdi nya ganti,Positif
tag wts pc nct mark sigundul selca digi bb johnny dicon grup jaehyun doyoung johnny,Netral
ngebayanginnya aja gua udh nang anjir keren bangeettt bismillah ya allah moga dapet tiket nonton aamiin,Netral
wkwkwkwk bagus dehhh bismillah nntn udah dpt 2 demoga tiket dpt,Netral
tuh back dancernya open org korea yah,Netral
hindi na talagaaaaaa,Netral
miss e  yeuhh gagal gue tutup tutupin tau bongkar juga,Negatif
ga jakarta hari gin gbk sih,Netral
wkwkwk fangirling nct akun yg tenang aja kaya btw fb akuu yaaa,Netral
momen ak daftar bekdenser yhhh,Netral
weh kesi dorg msti dorg risau dreamzen yg latah jelah korg nct https t co iyg2snrcdn,Netral
eh link nyaaaa,Netral
yg kemaren tes ombak ,Netral
kek let s be real laaa skrg double standard udh jarang cewe cowo kena trabas semua stop narasi2 gin bawa2 grup laen compare idol lu lagi riize 2 ex nct 2 member ex smrookies 2022 udh sempet ngeluarin siren,Negatif
henderyyy kalo ngga ,Netral
kemaren pas announcement gue udah bilang tes ombak gak percaya wkwk udah tau trik marketing sm tuh gin,Netral
yusirik sih ,Netral
jujur aja harap wamil out deh sm buat solo schedule alias out soloist biarin aja msh member nct kayak sunbae2 tuh,Netral
syarat anggota nct 1 lovlangnya physical touch,Netral
pengennnn,Netral
ga kejut sih trik marketing,Netral
streaming mv kpop ampe mabok g nyelem pc nct ampe tantrum,Negatif
sm ngadain audisi back dancer tds 3 pas buka form daftar jakarta 2 guys  nct https t co 2cmahrdakv,Netral
wtb sg red velvet rv 24 diary amp sticker sg nct 127 haechan set langsung co 3 3,Netral
deh,Netral
sorry oot btw yg ngikutin nct rasa bgt ya tumbuh piyik2 smpe gede vibes badboy ala ala,Negatif
bused atuy pangling bgt,Netral
nct wish juga unit nct ya kawann tolong cinta gak stan suka sedih klo liat yg gk nerima mereka,Positif
wtb  smini only  yangyang on my youth  ten ten mini album  prefer under 50k  udah scan gapapa cuman ku pake gantung t t want to buy album nct wayv nightwalker omy pc ina rd ready ina lfs aab,Positif
selimut bro,Netral
gua sapi qurban sion aja ya,Netral
nct - beautiful gw dengernya pas ngga lolos utbk,Positif
wts album only nct kihno 50k each jewel amp digipack 45k each take all 600k dom bogor oren  keep event request shopee video shopee live yukk cari album dm  https t co lmj4agjrcm,Positif
wts  want to sale photocard nct dream nct127 harga pict dom bogor co oren  keep event request shopee video shopee live yukk wl nya langsung dm  nego langsung dm aja https t co rri4ekcfyg,Positif
nct kalo tds3 pake backdancer moga intro hotsa nya kece yahh https t co icvyxtzb3o,Netral
it s yuyu s amp my month  nct dream cb chungha cb kino new solo tbz cb wendy cb ,Positif
milihnya merem nder cap cip cup,Netral
untuk ryo anak nct wish heh tu kiyowo kawai heh bayi gemes gak sadar gitulo sakuya adekmu cuman beda gak kalah gemesnya  please live peluk cium peluk cium buna pingin ikut wkwkw,Positif
nct w ilang dr tl ayo muncul sygku cinta dunia,Netral
info 29 02 24  nctwish entax nct nctwish cr sm nct  https t co tpjpfpa3wx https t co 7qx8w0ich5,Netral
info 29 02 24  nctwish entax nct nctwish cr sm nct  https t co tpjpfpa3wx  https t co huxevtscn9 https t co dzkmucfzw7,Netral
inimah si sm kudu ngerekrut mbak bjir,Netral
jaehyun nct,Netral
 difb yaa,Netral
 difb yaa cintaa,Netral
wts sharing nct dream 2024 season s greetings jaemin jeno haechan mark jisung renjun mark sg24 pola renjun ready ina kirim https t co c1g06kf8wz https t co ulqvsl7sui,Positif
set pakai tara bawa rumah tanah tanah ya yong,Netral
kalo sih mending tds sih kalo doll open ga si,Netral
 follback homophobic dni,Netral
pastu tiber nct 127 nak kena drag bangang,Negatif
ganteng pacar ,Netral
first acc pp nya renjun isi random aja sec acc nya pp nya item isi galau third acc pp nya winter isi ceria bohong ku  akun hype nct aespa ,Netral
 follback homophobic dni,Netral
nder yg nct cantik bgt gue aja yg cewe ampe insecure https t co qriqf3lee0,Negatif
morning noona noona iya gak sub unit lagi kalo boyband sm anak nct lagi udah debut nih noona 28 februari kemaren udah nonton mv denger lagu belooom dua noona japanese ver korean ver,Netral
tiktok 29 02 24  wwd jp no tiktok com jeno nct nctdream  https t co 3q8wehicrt https t co 8bb0hftbv7,Negatif
ken liat perut nyenyo tuing tuing emesh ,Netral
 yg suka jbjb jbjb hmphbc dni,Netral
homophobic dni gsh like klau gamau fb,Positif
bilang dmn,Netral
nct dream ganti layout,Positif
busetttttt bangun rumah ini,Netral
jeno ni bkn konsert nct  sporting je dgn fans2 ,Netral
gw semalem mimpi akun nct dream udah layout di mimpi gw ava nct dream gambar minum foto album foto member vs foto sekarang mana muncul si jeno rambut gondrong ahhhh bisa layout bawa mimpi gw gk smua critanya,Positif
minimal tuh fasilitas ambulance gila aja udah kaya gitu,Netral
salam kenal oneechan boleeh banget nct wish sub unit nct udah debutin sub unit sub unit based promosi group basednya jepang korea promosi,Positif
lanjutt open ya jasa tutor nya   selkor grup thai kr jp ch nyelem po an murce album merch pc photocard sellkor selkor sellthai sellusa sellmalay sellviet selljep sellph istilah lfb qyop tf won open wh go admin nol nct zb1 treasure 2tutornyelemlia https t co kkizxpufcm,Positif
haloo po album nct wish boleehh yuu langsung isi gform aja yaa bookslot dlu cicil close 3 maret thankss  https t co rwkoz3gz9m tags wts nct wish single album wish zonauang zonajajan nctwish https t co pislg65xdl,Positif
njir besok senin nct wish showcase,Positif
haloo po album nct wish boleehh yuu langsung isi gform aja yaa bookslot dlu cicil close 3 maret thankss  https t co eaddxdyquf tags wts nct wish single album wish zonauang zonajajan nctwish https t co k3yx7uhqr2,Positif
potong rambut kah,Netral
homophobic dni gsh like klau gamau fb,Positif
taeyong gamau bayarin ukt ,Netral
cdm ka album under 35k  pc nct under 17k smua,Netral
nct  jaemin jungwoo amp renjun svt  jeonghan skz  felix amp hyunjin enhypen  sunoo zb1  zhang hao amp ricky,Netral
juragan woyyy,Netral
 johfam ayo mutualan,Netral
bener aja sayang ku ckep bener,Netral
aja orang gila dunia macem ni budak ,Netral
cowoku ini primadona nct https t co 1b2ezyndih,Netral
taeyong nct jaehyun nct gue aku kalo ganteng ganteng bgt asli dah kek yg iya ganteng udh gitu aja ,Netral
mowningg yuk yg mo langgan panjang bubble sung wa on bio  process satset pkai akun cust garansi legal ppj hearts aman  zonauang t wts jual beli wtb bbl lysn murah stars nct exo skz wayv zerobaseone zb1 jyp twice nmixx day6 xdinary heroes mark haechan jaemin,Positif
mba taeng rival musuc chart group gen nct wish group bgt ya rv trus espa trus alhamdulillah eks ya mba kesini ,Positif
mah milik farm g si,Netral
abistu udah pulang gua dgn bahagia post sg selfie sm mark ruang tamu rmh oma gua trus besok nct mng auditorium gt sistem tu mobil yg ngetem jalan rumah random ytta aja trus dianterin mallnya,Positif
bangsat semalem gua mimpi nct smtown tampil tengah2 tram stop tp jakarta anying kek dalam gitu trus jd yg nonton dikit bgt yaiyala goblok trus pas suju tampil mrk bubar yg ntn sepi,Negatif
busettt dah bgt nct kesini dream erra hello future ,Positif
nct wish isi nya cowok physical touch ,Positif
fav unit unit bias jaehyun album nct 2020  resonance,Positif
bentarr tumben denger lagu nct dream yg ini yaa tinggal kahhh,Positif
 selective jfb,Netral
lovelang gue jd physical touch jg grgr stan nct,Netral
udah fix ya nct c nya clingy,Netral
kocak banget anjoiiii,Netral
kalo gabisa nct yg nct nct yg lain,Netral
harta tahta yutaaaa,Netral
done saking exol nya udah asa kayak keluarga juga asa sodara keponakan juga bahagia bahagia juga saking nctzennya exited bau nct bismillah thn ketemu semua,Netral
yuta mode rambut hitam tu emang beneran cowo anime ,Netral
if u see this qrt w ur bias from each bg  bts - tae tae amp yoongi zb1 - taerae amp jiwoong nct -taeyong amp ten svt - the8 jun vernon amp dino skz - binnie in 2min ateez -hong hwa yeo txt - soobie amp yeonjun p1h - keeho amp soul monsta x - 8turn - minho tbz - bnd -tae amp riwoo enha - jake amp sunoo,Negatif
alesan gua suka nct ,Netral
if u see this qrt w ur bias from each bg  bts - yoongi hobi zb1 - gunwook matthew nct - yuta ten svt - jeonghan minghao skz - jisung ateez - hongjoong ot8 txt - yeonjun beomgyu p1h - jiung jongseob monsta x - 8turn - tbz - chanhee bnd - jaehyun woonhak enha - jungwon,Negatif
umur hidup with jisung mars mah go jabanin,Netral
kalo 1,Netral
mark lahhh dapet bonus rapunzel jasmine ya,Positif
semangat kak ketemu bubu abis vc an sm bubu peluk nuna udah suruh pulang tp malem nya ttp keliar,Netral
speaker nya abis ya biar mbak istirahat ,Netral
gemecc bgtt cowokuu,Netral
cocok nih temenan haknyeon juragan hewan ternak yg ternak babi yg ternak sapi,Netral
kalo anak nct dr live wv emang sub nya kak,Netral
yuta cahaya asia,Netral
qrt w ur bias from each bg bts - namjoon seokjin zb1 -zhanghao gyuvin nct - taeyong ten jaemin svt - scoups jeonghan joshua hoshi skz - chan minho ateez - hongjoong txt - yeonjun beomgyu p1h - theo monsta x - minhyuk tbz - jacob sangyeon bnd - woonhak  riwoo enha - hee,Negatif
album nya nct wish goda bgt ya allah lucu lagi tp rest jajan inget tds3 mata,Positif
berisikk bgtt beneran nct,Netral
taeyong butuh beban ga beban,Netral
lu smwa yg hate nct wish ga ngerasa hate bocil beneran bocio ternyaa,Negatif
ku usaha resign alas ikut suami suami yg ku maksud lee taeyong,Negatif
bismillahirrahmanirrahim mark yok yok https t co uftx6h451r,Netral
meu top 3 kpop gg 1 aespa 2 nmixx 3 twice bg 1 skz 2 exo 3 nct idols 1 hyunjin 2 minseok 3 jaehyun,Positif
nct wish diem gak takut oleng nak nafkah bocil2,Positif
if u see this qrt w ur bias from each bg  bts - jimin zb1 - ricky nct - yuta jaehyun svt - jun dk skz - hyunjin ateez - mingi seonghwa txt - taehyun soobin p1h - intak soul theo monsta x - changkyun hyungwon 8turn - don t stan tbz - haknyeon bnd - don t stan enha - jake,Negatif
ngakak pas lagu nct member lesserafim gk tau lol pdhl udh didenger berkali2 tp ttp gk tau lagu apa emg bener kyknya org yg tau lagu nct fansnya doang wkwk  https t co hcfnbk5eyj,Positif
bulan dengerin album ten amazed lagunyaaaa  nct ten ten https t co im3t3hooug,Positif
1m 2 outfit ya wajar sih bubu duit,Netral
if u see this qrt w ur bias from each bg  bts - jk jm zb1 - mattwook nct - jeno ten svt - jeonghan skz - hyunjin ateez - hj sh txt - taehyun yeonjun p1h - ot6 monsta x - shownu 8turn - kyungmin haemin tbz - new q sunwoo bnd - jaehyun taesan enha - jake hee,Positif
nontonin konten nct wish liat tingkah ryo eunseok versi extrovert,Positif
busettt bwang dah taw lom,Netral
bjir beneran ga si,Netral
hanbin dri msh jdi dancer jg udah suka cover dance nct ya pas audisi bous planet bawain lagu nya taeil yg starlight bias jaehyun dn skrg panggung frame dgn member nct sukses fanboy,Negatif
bener nder yuta photoshoot ganteng banget ngett ngeettt model magazine jarang dipromosiin aja ama esem  https t co idaeaz8x6z,Netral
 thank you secured 96 pcs single album nct wish wish yg ikut po estimasi lunas minggu dua tiga maret ya mohon tunggu tags join go nct wish banget dm ya https t co eo6i8lvoze,Positif
 thank you secured 96 pcs single album nct wish wish yg ikut po estimasi lunas minggu dua tiga maret ya mohon tunggu tags join go nct wish banget dm ya https t co dujwwzw4f4,Positif
riize nct wish,Positif
makasih kak,Netral
ku aku cha eun woo kim taehyung jaehyun nct tuh ganteng gak manusiawi gue aja ,Positif
rules wajib 1 like postingan ga 2 follow ig tiktok amp x 3 komen nctzen exol amp mention 2 teman ya  ended 11 03 at 11 59pm  announce 12 03 at 2pm  3 winners  diary sg 24 nct dream smini exist chen ver pc hendery yuta,Positif
anniversary give away halo sobat nuna ga rasa go nunasholehot udah taun wajib ga gak nih yuk ramein bareng giveaway kpopmerch exo nct nctdream nct127 wayv smtown2024 zonauang https t co r4h3te6bmk,Netral
um sonho  enhypen nct exo e riize na empresa do baekhyun,Netral
kayak ilicil ad org yg jemaah nya kalo bts yah live skrg ntar siang sore besok udh ad sub indo eng nya,Negatif
240229 actualizaci n del instagram de nct wish con sion y riku b o o m s h a k a l a k a sion   riku   nctwish nctwishiscoming nct wish https t co iym1fgt4gr,Positif
wv nya say klik aja pojok kanan titik 3 itu macem sbnrnya ga mesti besok langsung gitu kadang 2 pr 3 sampe kadang minggu bru,Netral
seru bgt nct nambah unit means perang tiga nyata wkwk  ga ikut ah,Netral
besok langsung nder,Netral
refleks tahan nafas ganteng bgt anjirrr yutaaa,Netral
konser aja duluin,Netral
ya live weverse member subtitlenya nct,Netral
bts - zb1 - hanbin ricky nct - ten doyoung renjun svt - joshua seungcheol minghao skz - jeongin ateez - hongjoong wooyoung txt - soobin p1h - taeyang monsta x - kihyun 8turn - seungheon tbz - eric juyeon hyunjae bnd - leehan enha - heeseung sunghoon jungwon,Netral
kayak nct dream kena mulu alias seret kkyu aja ribut kayak publik tau kkyu identik dream ya kalo make monggo 1 bendera juga support each other aja,Positif
jaehyun cakep bgt,Netral
lucu banget yailah,Netral
menyalaaaa abangkuuuu,Netral
cocok lg namanye nct fourth,Netral
mnrt gw muka fourth muka nct banget kl jd idol join nct dream https t co 8cp2leihlw,Positif
milih merem ak ga nyesel,Netral
tangerang 2019 yuhuuuu,Netral
wts photocard official nct ready ina take all only foto rp 480 000 dom jateng keep event with dp packing  admin haechan pangeran lucky draw fact check mark boneka jeno nct zone jaehyun dojaejung https t co h9wsl9bt9q,Positif
ganteng,Netral
kalo gue korea ketemu diaaa gue traktirrr makan sumpahhhhhh,Netral
gantebg bgttt yuta,Netral
sumpah gue si speechless tb2 2024 berkah bgt yaallah smg berkah untung lanjut sampe ak dpt tiket tds 3 sm konser weipi ntar aamiin tkt keburu abis untung gue nct zone anjir  https t co upbgtseytp,Netral
bubuu hyuung,Netral
 20 feb 24 renjun nandemonaiya x indo 1 renjun nandemonaiya x nct dream 1 renppyhours 1 https t co svmiztoc0v,Positif
nct wish bener bener bocah bocah lindung sayang banget ,Positif
lucu banget wkwk,Netral
wehhhhhhh dreamzen solostan dream ayo focus cb drimini aja rumbling center 4 klw hati panas center 4 lampias tau drama web nct dream,Positif
wto wts pc jaehyun steampunk concept ready ina langsung co event 3 3 bersih 40k ajaa tags pc nct zone neo culture technology konsep jh photocard wtb,Positif
serius jaehyun nct gatau gapernah naksir sm pdhl cegilnya,Netral
zzzzzz o  o yuk yuk tinggal tidur 3m https t co u1erhddjne,Netral
 giveaway alert  mug nct dream  127 request nama member 2 orang menang ya syarat - rt  rep bias - follow sila follow yaa difb - menang tentu random spinwheel good luck gaisss https t co agavhb1x4n,Positif
haloo plis nanya kmrn rame truz unoff ga beli klo kek gin beli ga si dar tarok tas sklh kek sayang gitu lo klo official gantung takut ilang jujur https t co ltatcfozzr,Netral
open jasa war ticketing service radwimps world tour 2024 in jakarta and bangkok  pake data pribadi  fee 150k-250k tiket  alam war konser kpop svt nct blackpink  testi war pin  no dp amp fee stlh dpt tiket konser jastip jkt wts wtt wtb ticket https t co ktfopjvppj,Negatif
open jasa war ticketing service iu h e r world tour concert in jakarta  pake data pribadi  fee 250k tiket  alam war konser kpop svt nct blackpink  testi war pin  no dp amp fee stlh dpt tiket konser jastip jkt wts wtt wtb ticket her https t co 65ea904ekz,Negatif
open jasa war ticketing service 2024 treasure reboot in jakarta  pake data pribadi data team  fee 200k tiket jasa war  fee 250k tiket jastip  alam war konser svt nct coldplay  testi war pin  no dp amp fee stlh dpt tiket konser jastip jkt wts wtt wtb trejo https t co hfbo6gacqq,Negatif
open jasa war ticketing service 2024 the dream show 3 in jakarta  pake data pribadi data team  fee 400k tiket jasa war  fee 450k tiket jastip  alam war konser svt nct coldplay  testi war pin  no dp amp fee stlh dpt tiket konser jastip jkt wts wtt wtb tds https t co mvwcvx8emg,Negatif
open jasa war ticketing service 2024 tvxq asia tour 20 amp 2 in jakarta presale general  pake data pribadi  fee 200k tiket  alam war konser svt nct coldplay  testi war pin  no dp amp fee stlh dpt tiket konser jastip jkt wts wtt wtb ticket https t co ncxfqshykz,Negatif
annyeong maret,Netral
open jasa war ticketing service 2024 baekhyun asia tour lonsdaleite in jakarta  pake data pribadi  fee 250k tiket  alam war konser svt nct coldplay  testi war pin  no dp amp fee stlh dpt tiket konser jastip jkt wts wtt wtb ticket https t co jit2hjcqf3,Negatif
ken ketemu taeyong rl,Netral
open jasa war ticketing service 2024 aespa love tour synk parallel in jakarta bangkok singapore  pake data pribadi  fee 200k tiket  alam war konser svt nct coldplay  testi war pin  no dp amp fee stlh dpt tiket konser jastip jkt wts wtt wtb ticket https t co zqz8s0f2ic,Negatif
gw plelist nct doang cakup unit solo https t co 68kjvultay,Netral
apas ajg yusirik ,Netral
mt nct zone susah bener pake data server is not responding pake wifi bgt ga login2 gimana sih,Netral
alas utama gua ken nct nation indo ya iniii si dejun pado ini,Negatif
saran tia,Positif
sender tuh pgn tp ms bingung gt kalo sender beli dollnya tabung sender nyisa gt mending sender skip doll sender beli aja ya sender si ngerasa keburu nabung dr maret smpe ticketing kalo sender beli doll kaya bingung aja gitu cont,Positif
nct no bantu sender sender bingung sender rencana nonton tds 3 tabung tuh dikit nabung doll bias sender sender wlin udah tuh makernya lg open tp doll yg sender tuh 40cm gt kisar harga tuh 650-700san cont,Negatif
if u see this qrt w ur bias from each bg  bts - yoongi zb1 - hanbin gyuvin nct - jaemin hendery yangyang xiaojun svt - mingyu wonwoo minghao cheol skz - chan ateez - san yunho txt - yeonjun soonin beomgyu p1h - jiung monsta x - 8turn - tbz - sunwoo bnd - enha - hee jake,Negatif
jeno x moevir  jeno nctdream nct https t co pdgu9sts9b,Netral
kaget kalo liat au ank nct yg nge like sampe ribu anjirr kayaa bjirr tame bgt coyy,Positif
requdh dr jam brp trs sempet gk diblhin gue hopeless smp mikir ok maybe next time pas ending tb vn gue puter smp lagu nct wish -nya jg  kaget dikit gk ngaruh  gpp playnya malem jam 12 30-an yg nct wish masuk radio prambors https t co bm55gnyb7l,Positif
ha okay hahahahahaha the baseballer kisah sbb minat yg tu kaksksksksks ingt kn shohei nct kejut gue,Positif
kangen bgt nct nation lg gaksih sayang gmn dong,Netral
lucu bgt melihara sapi,Netral
kak mjb konten yaa blm stan nct wkt ituu,Netral
emang nct l nya lawak sih udahlah,Netral
banget ngedraw sampe 5x10 biar dapet stampunk   nct zone plis aja lucky gabisa ta https t co oar95dbekh,Positif
ilang nggak sih babak bur bonyok banget pulang 2-3 demo real jadi 2017 kalo nggak salah temen kampus ngga langsung pasca demo sebar foto babak bur dalem sel tahan,Netral
wahhh iniii cakeppp bangettt gila sih kalo kaga pacar bener aja rugi donggg,Netral
nct wish masuk prambors malem krn iseng gue ngenalin nct cabang wish biar diputerin lagu gk luku broken melodies fly away with me aja  https t co cdoqlw7eg1,Positif
jir moga lg ya beb  cctv ndaa sekitar motor km,Netral
butuh go nct dom sekitar sumatra,Netral
pacarrr cakepp bangett woiii love banget mahh,Positif
plis w syg renhyuck tp w jg syg mark lee w syg smua mem nct tp kek ngerti ktika lu suka ama banget trus org blg lu freak kek ap kesel lah tai wkwkwkw,Negatif
genre film apaaanih,Netral
gas go wa line nct dom sumatra dom pekanbaru medan lampung padang gitu biar ga nang gegara ongkir lagi,Netral
pc mark lightstick nct yuk 120k ajaaa dom surabaya jatim,Netral
nct lastart emangg palingg keren sii sampe suka rewatch nang dikit liat ga debut,Netral
hah anjir  maling gimane,Netral
edit timestamp ntar mreka udh gede nct trus qt i was here wkkwkwkw,Positif
emg polo yg tdk tulis polo bagi fto milik renjun nct polo baru denim jga tdk tulis tp bear huruf p https t co znsyg6iy52,Netral
kerennn,Netral
bjir war tiket kereta kek war tiket nct ,Negatif
open jaswar tiket konser nct dream  the dream show 3 tds 3 bangkok ya kalo yg ken dm aja  pake akun pribadi  bayar self payment  100 trusted nctdream tds3 jaswar jastip zonauang wts wtb nct https t co cs2h79uygv,Positif
open jaswar tiket konser nct dream  the dream show 3 tds 3 singapore ya kalo yg ken dm aja  pake akun tm  bayar self payment  100 trusted  2 slot nctdream tds3 jaswar jastip zonauang wts wtb nct https t co gnulk6ydoj,Positif
juragan sapi rill cuy ayo ayo sapa jd cewenya biar ftv nya tayang cinta kandang sapi ,Netral
nahh hooh pis  kek aduh bnran orkor malaikat unreal bgt,Netral
my ultimate bias injun setia injun emosi peduli kiyowo pasti,Negatif
nct dream 2 gbk yuk yuk,Positif
keren mbak nya,Netral
dlu the link konten nct sbnernya spill 2hr,Netral
laku grup nct 127 ,Netral
bibub enhypen moga jauh dr org jahat nct wish juga,Positif
dh open po blomm,Negatif
nct dream jkt 2 rumor bau bau gak gbk,Positif
iyapp asli ka zegg album nct wish lucu,Positif
sumpah gw sering dgrin ai nct nyanyiin lagu cm jd mikir ni jeno ky cocok bgt kl gantiin linenya ty,Positif
lepasni nct anak hybe,Netral
eh emoji fav-nya udah  yabsejak nct wayv,Netral
nge reminder mutualku yg wishzen gak nyama nyamain nct wish unit  alhamdulillah klo ga bakar mah maap klo dz ngerasa ga terima yg nyama nyamain ciri khas dream wish usaha negur -,Positif
muka jaehyun banget,Netral
sapi township ,Netral
role model kalian riku nct mark anderson nct mark ryo nct doyoung oke pick wkwkwkwkwkwk beneran debut dua ih jago w ngepick ,Netral
wtb figure mark tumbler nct dream x sf cema thailand gak ,Positif
gua galau backingan gua nct seventeen exo drakor vlog idol varshow sedih sih aja ngertj ga si,Netral
open back dancer nih nct dream tds3 mayan freelance siapin cv buru https t co igukk4cpsd,Positif
eh kayak nct zone yg lucu ya sempet main lagi,Netral
melihara yak ternak,Netral
gak sih yg war fans nct yg beda unit musnah tl gua aja capek bgt liat gak kelar2 aja yg protesin gitu ,Negatif
nct 127 with pob yes24 - johnny set 35 000 - doyoung set 45 000 - yuta set 35 000 - pola mark 40 000 riize with pob yes24 - shotaro set 30 000 - box 20 000 - poster 2 15 000 exo with pob smstore - xiumin set 40 000 - chen set 40 000 - pola random 40 000 - box  pc grup 50 000,Netral
pilih nie jjur enih pilih syulit mark,Netral
ayo pc lightstick nct fix dapet mark lee 120k dp 80k proof nya lgsg dm ajaa  go line  wa  surabaya tag wts wtb pc ls mark lee nct,Netral
abang hidden member-nya nct 127 ya,Netral
akaun tiktok hiks member kat takmo usik akaun tiktok tu khas nct ha ni khas taehyungg or mana laki suka silap haribulan letak harry potter kat hahahah randomnya idol korea pastu tiber harry potterhahahaha https t co w0lqwaf98t,Positif
gatau udh gak ngikutin nct ,Netral
tempura date nct wish,Positif
tajir bat calon suami udh nih beban,Netral
nct wish - nasa keren ,Positif
juragan sapi ,Netral
haloo jual pc mark jeno good condition harga pasar ya tp jgn sadis juga nya udah henti koleksi kalo take all makasih btw lewat wts nct mark jeno ina nct127 nctdream https t co u8j91seqam,Positif
kekal rumah kebel 4 rumah subsidi ya kalo minggu rumah mah beli btn,Netral
gw gapaham sebenernya heboh amp panik tuh fansnya dahal drimjen gw liat gaada ngemocking deh bilang thankyou udah respect dream bilang tds jahat ds toxic tuh sebenernya gitu loooh ,Positif
btw kl nonton fansign nct wish yg kemaren chanel yt upload yg versi fullnya sm yg fancam member jg https t co tsv7kantnl,Positif
wts pc nct 127 mark dicon jepang full set henti koleksi pc  wts nct127 mark marklee,Netral
flo bangun flo tidur muluuu,Netral
stationhead grup member udah channel fandom kayak bts bp nct dream got7 aespa,Positif
samaa gilakk keren bgt performance why bom nonton coba deh aja nonton performance nya why - nct lastart keren bgt bom niat ngikutin iseng nonton aja skrg suka vokal mateng semua menimal umur hidup nonton,Netral
nya outfit ma aksesoris pribadi si esem ner bener asuu untung cowo gweh kaya raya total nya dapet rumah gimana bangun rumah tangga yong,Netral
nct nation nyaa bebb  md nyaa,Netral
lupa follback gaisss,Netral
maraton dms gt tap gt jurnalisa gt tap apakah taeyong masuk beranda cinta horor hihi,Positif
atuy sumpah lu cakep benerr,Netral
cwk sapa cakep bangeetttt ,Netral
buka aja coba channel yt nct wish nya beb liat video,Positif
have pc nct want pc enhypen maksud ,Positif
yg nct klo gk salah putih pendek liat rangkul temennya panggung tuh fans cewek sangking cantik ama putih ,Netral
 lelang go trigger the fever  batch 2  1 amp 2 maret 18 30 wib  start from 3k-10k ea  khusus lelang fee go  tangerang t wts nct taeil johnny taeyong yuta doyoung winwin jungwoo mark hendery renjun jeno haechan jaemin chenle sungchan shotaro jisung https t co 94yobcgnjt,Netral
nge reminder mutualku ga bilang nct wish bakwan sayur kak gaada nyenggol ya mohon maap  klo bukti yaa https t co dgjpjoxvtf,Positif
juragan sapi,Netral
trs qrt terjemah live ngapa bawa2 fans dreamies bilang sipaling toxic sipaling bikin trauma emang dz nonton live kah idolnya trauma pose,Negatif
tu bingung bawa2 narasi ngelibatin dz nuduh sini yg harap sih dr respon kita jelas2 ntu idolnya pose trandmark wichu hubung ama kyuu a dreamies apaaan,Netral
mjb salah  nih beneran cocok nct chaos bgt,Negatif
